35144069;35;Jawa Timur;14;3514;Pasuruan;4;Dokter Praktek Mandiri;069;dr. HODIJAH;Bangil;;;;
35144070;35;Jawa Timur;14;3514;Pasuruan;4;Dokter Praktek Mandiri;070;dr. ICA PURNAMASARI;;;;;
35144071;35;Jawa Timur;14;3514;Pasuruan;4;Dokter Praktek Mandiri;071;dr. IFA FAUZIAH;;;;;
35144072;35;Jawa Timur;14;3514;Pasuruan;4;Dokter Praktek Mandiri;072;dr. IMELDA RITUNGA;;;;;
35144073;35;Jawa Timur;14;3514;Pasuruan;4;Dokter Praktek Mandiri;073;dr. INAYATI;Lekok;;;;
35144074;35;Jawa Timur;14;3514;Pasuruan;4;Dokter Praktek Mandiri;074;dr. INDAH DEWI ASTREANI;;;;;
35144075;35;Jawa Timur;14;3514;Pasuruan;4;Dokter Praktek Mandiri;075;dr. INKHUD MUAWANAH;Pandaan;;;;
35144076;35;Jawa Timur;14;3514;Pasuruan;4;Dokter Praktek Mandiri;076;dr. JULIANA;;;;;
35144077;35;Jawa Timur;14;3514;Pasuruan;4;Dokter Praktek Mandiri;077;dr. KHUMAIDI;;;;;
35144078;35;Jawa Timur;14;3514;Pasuruan;4;Dokter Praktek Mandiri;078;dr. KOENTJORO JOEWONO;;;;;
35144079;35;Jawa Timur;14;3514;Pasuruan;4;Dokter Praktek Mandiri;079;dr. KRISTINA INDRIJATI;;;;;
35144080;35;Jawa Timur;14;3514;Pasuruan;4;Dokter Praktek Mandiri;080;dr. LIA AZKA NIYAZI;Winongan;;;;
35144081;35;Jawa Timur;14;3514;Pasuruan;4;Dokter Praktek Mandiri;081;dr. LILIANI;Bangil;;;;
35144082;35;Jawa Timur;14;3514;Pasuruan;4;Dokter Praktek Mandiri;082;dr. LILIK TJENDRAYANI;;;;;
35144083;35;Jawa Timur;14;3514;Pasuruan;4;Dokter Praktek Mandiri;083;dr. LINDA OCTAFIA EKA PUSPITA;;;;;
35144084;35;Jawa Timur;14;3514;Pasuruan;4;Dokter Praktek Mandiri;084;dr. M. MUSTAFA KAHMARUDDIN. Sp. A;Bangil;;;;
35144085;35;Jawa Timur;14;3514;Pasuruan;4;Dokter Praktek Mandiri;085;dr. MELANY;;;;;
35144086;35;Jawa Timur;14;3514;Pasuruan;4;Dokter Praktek Mandiri;086;dr. MOCH. MASYKUR;;;;;
35144087;35;Jawa Timur;14;3514;Pasuruan;4;Dokter Praktek Mandiri;087;dr. MOCHAMAD NUR SULTAN;;;;;
35144088;35;Jawa Timur;14;3514;Pasuruan;4;Dokter Praktek Mandiri;088;dr. MOH. FANGKY PRIO SUDRAJAT;;;;;
35144089;35;Jawa Timur;14;3514;Pasuruan;4;Dokter Praktek Mandiri;089;dr. MOHAMMAD FARID;;;;;
35144090;35;Jawa Timur;14;3514;Pasuruan;4;Dokter Praktek Mandiri;090;dr. MOHAMMAD FERRY NUR ABADI;;;;;
35144091;35;Jawa Timur;14;3514;Pasuruan;4;Dokter Praktek Mandiri;091;dr. MUFIDATUL UMMAH;;;;;
35144092;35;Jawa Timur;14;3514;Pasuruan;4;Dokter Praktek Mandiri;092;dr. MUHAMMAD ABDUL RAZAK;;;;;
35144093;35;Jawa Timur;14;3514;Pasuruan;4;Dokter Praktek Mandiri;093;dr. MUHAMMAD SAIFUR RIZAL;;;;;
35144094;35;Jawa Timur;14;3514;Pasuruan;4;Dokter Praktek Mandiri;094;dr. MULYANI;;;;;
35144095;35;Jawa Timur;14;3514;Pasuruan;4;Dokter Praktek Mandiri;095;dr. NAILUL MAGHFIROH;Gempol;;;;
35144096;35;Jawa Timur;14;3514;Pasuruan;4;Dokter Praktek Mandiri;096;dr. NANANG FAUJI;;;;;
35144097;35;Jawa Timur;14;3514;Pasuruan;4;Dokter Praktek Mandiri;097;dr. NANANG HARI PAMURAHARJO;Gondangwetan;;;;
35144098;35;Jawa Timur;14;3514;Pasuruan;4;Dokter Praktek Mandiri;098;dr. NGAKAN MADE ANDRI PURNAMA;;;;;
35144099;35;Jawa Timur;14;3514;Pasuruan;4;Dokter Praktek Mandiri;099;dr. NORA SAKINAH EKA SUNDUSIA;;;;;
35144100;35;Jawa Timur;14;3514;Pasuruan;4;Dokter Praktek Mandiri;100;dr. NOVILIA RINI WAHYUNI;;;;;
35144101;35;Jawa Timur;14;3514;Pasuruan;4;Dokter Praktek Mandiri;101;dr. NUR LAILA DWI PURNAMI;Sebani;;;;
35144102;35;Jawa Timur;14;3514;Pasuruan;4;Dokter Praktek Mandiri;102;dr. NUR'AINI FATMAWATI;;;;;
35144103;35;Jawa Timur;14;3514;Pasuruan;4;Dokter Praktek Mandiri;103;Dr. NURHADJI;;;;;
35144104;35;Jawa Timur;14;3514;Pasuruan;4;Dokter Praktek Mandiri;104;dr. NURIDA INDAHARI;;;;;
35144105;35;Jawa Timur;14;3514;Pasuruan;4;Dokter Praktek Mandiri;105;dr. OMALI, SH.;;;;;
35144106;35;Jawa Timur;14;3514;Pasuruan;4;Dokter Praktek Mandiri;106;dr. PUDJI SETIJAWATI;;;;;
35144107;35;Jawa Timur;14;3514;Pasuruan;4;Dokter Praktek Mandiri;107;dr. RAGIL WIDODO BUDI NUGROHO;;;;;
35144108;35;Jawa Timur;14;3514;Pasuruan;4;Dokter Praktek Mandiri;108;dr. RAKANITA TIARA PUSPITASARI;;;;;
35144109;35;Jawa Timur;14;3514;Pasuruan;4;Dokter Praktek Mandiri;109;dr. RAMANAWATI;;;;;
35144110;35;Jawa Timur;14;3514;Pasuruan;4;Dokter Praktek Mandiri;110;dr. RANGGA YUDHISTIRA;;;;;
35144111;35;Jawa Timur;14;3514;Pasuruan;4;Dokter Praktek Mandiri;111;dr. RATNA SURYATI HALIM;;;;;
35144112;35;Jawa Timur;14;3514;Pasuruan;4;Dokter Praktek Mandiri;112;dr. RENDRA SATRIA PUTRA PRATAMA;;;;;
35144113;35;Jawa Timur;14;3514;Pasuruan;4;Dokter Praktek Mandiri;113;dr. REZZA DWI HARYANTO;;;;;
35144114;35;Jawa Timur;14;3514;Pasuruan;4;Dokter Praktek Mandiri;114;dr. RIFRINDRA ADENIAR RAHMI;;;;;
35144115;35;Jawa Timur;14;3514;Pasuruan;4;Dokter Praktek Mandiri;115;dr. RIZKA OKTAVIA ARIYANTI;;;;;
35144116;35;Jawa Timur;14;3514;Pasuruan;4;Dokter Praktek Mandiri;116;dr. RUDI RAKHMAD HIDAYATULLAH;;;;;
35144117;35;Jawa Timur;14;3514;Pasuruan;4;Dokter Praktek Mandiri;117;dr. SAKINAH;Bangil;;;;
35144118;35;Jawa Timur;14;3514;Pasuruan;4;Dokter Praktek Mandiri;118;dr. SEPTIAN KRISTYANA;;;;;
35144119;35;Jawa Timur;14;3514;Pasuruan;4;Dokter Praktek Mandiri;119;dr. SEPTY IRMITHA YUNUS;;;;;
35144120;35;Jawa Timur;14;3514;Pasuruan;4;Dokter Praktek Mandiri;120;dr. SHINTA APRILIANA;Karangrejo;;;;
35144121;35;Jawa Timur;14;3514;Pasuruan;4;Dokter Praktek Mandiri;121;dr. SILVIANTI BUDI RAHMAWATI;;;;;
35144122;35;Jawa Timur;14;3514;Pasuruan;4;Dokter Praktek Mandiri;122;dr. SISWA PURNOMO;;;;;
35144123;35;Jawa Timur;14;3514;Pasuruan;4;Dokter Praktek Mandiri;123;dr. SITI CHOLIFAH;;;;;
35144124;35;Jawa Timur;14;3514;Pasuruan;4;Dokter Praktek Mandiri;124;dr. SITI FAIQOH;Wonorejo;;dr. Siti Faiqoh;0815-5361-1933;
35144125;35;Jawa Timur;14;3514;Pasuruan;4;Dokter Praktek Mandiri;125;dr. SITI NAFISATUL YASMINE AZZACKIYAH;;;;;
35144126;35;Jawa Timur;14;3514;Pasuruan;4;Dokter Praktek Mandiri;126;dr. SOEHERIYANTO, Sp.A;Praktek di RSI Masyithoh;;;;
35144127;35;Jawa Timur;14;3514;Pasuruan;4;Dokter Praktek Mandiri;127;dr. Sri Martariani;;;;;
35144128;35;Jawa Timur;14;3514;Pasuruan;4;Dokter Praktek Mandiri;128;dr. SRI SETYOJAYANTI;;;;;
35144129;35;Jawa Timur;14;3514;Pasuruan;4;Dokter Praktek Mandiri;129;dr. SRI ULUPI;;;;;
35144130;35;Jawa Timur;14;3514;Pasuruan;4;Dokter Praktek Mandiri;130;dr. SRI WULANDARI;Gempol;;;;
35144131;35;Jawa Timur;14;3514;Pasuruan;4;Dokter Praktek Mandiri;131;dr. SUPRAPTO;;;;;
35144132;35;Jawa Timur;14;3514;Pasuruan;4;Dokter Praktek Mandiri;132;dr. SURYO WIBOWO;Kejayan;;;;
35144133;35;Jawa Timur;14;3514;Pasuruan;4;Dokter Praktek Mandiri;133;dr. SUTRISNO OETOMO;;;;;
35144134;35;Jawa Timur;14;3514;Pasuruan;4;Dokter Praktek Mandiri;134;dr. SYLVIA PICA SEPTIANA PUTRI;;;;;
35144135;35;Jawa Timur;14;3514;Pasuruan;4;Dokter Praktek Mandiri;135;dr. TALIFFIA SETYA HARYANTIWI;Gondangwetan;;dr. Taliffia Setya Haryantiwi;0813-3394-3249;
35144136;35;Jawa Timur;14;3514;Pasuruan;4;Dokter Praktek Mandiri;136;dr. TAUFIK;Kejayan;;;;
35144137;35;Jawa Timur;14;3514;Pasuruan;4;Dokter Praktek Mandiri;137;dr. TH. ASIH SURYANTINI;;;;;
35144138;35;Jawa Timur;14;3514;Pasuruan;4;Dokter Praktek Mandiri;138;dr. TH. SANTOSO WIDODO;;;;;
35144139;35;Jawa Timur;14;3514;Pasuruan;4;Dokter Praktek Mandiri;139;dr. TRI HARDINA SETIYO;;;;;
35144140;35;Jawa Timur;14;3514;Pasuruan;4;Dokter Praktek Mandiri;140;dr. TUTUR SASONGKO;;;;;
35144141;35;Jawa Timur;14;3514;Pasuruan;4;Dokter Praktek Mandiri;141;dr. VIRDO NOVIAN FIRNAKO;;;;;
35144142;35;Jawa Timur;14;3514;Pasuruan;4;Dokter Praktek Mandiri;142;dr. WINDARTI;;;;;
35144143;35;Jawa Timur;14;3514;Pasuruan;4;Dokter Praktek Mandiri;143;dr. WIWIK ANIASIH;;;;;
35144144;35;Jawa Timur;14;3514;Pasuruan;4;Dokter Praktek Mandiri;144;dr. YENNY APRILIYA;;;;;
35144145;35;Jawa Timur;14;3514;Pasuruan;4;Dokter Praktek Mandiri;145;dr. ZAENAL FANANI;Gempol;;;;
35144146;35;Jawa Timur;14;3514;Pasuruan;4;Dokter Praktek Mandiri;146;dr. AVINDA DEVIANA;;;;;
35144147;35;Jawa Timur;14;3514;Pasuruan;4;Dokter Praktek Mandiri;147;dr. EVA SUSANTI;Sumberpitu;;;;
35144148;35;Jawa Timur;14;3514;Pasuruan;4;Dokter Praktek Mandiri;148;dr. KERISFI MEGAH PURNAMA;;;;;
35144149;35;Jawa Timur;14;3514;Pasuruan;4;Dokter Praktek Mandiri;149;dr. NOER IZZA KUSMAWARDANI;;;;;
35144150;35;Jawa Timur;14;3514;Pasuruan;4;Dokter Praktek Mandiri;150;dr. NOVITA MAULIDIYAH, Sp.P;;;;;
35144151;35;Jawa Timur;14;3514;Pasuruan;4;Dokter Praktek Mandiri;151;dr. RAIS HAKIM;Dusun Krajan, RT.01/RW.03, Sukodermo, Kec. Purwosari;;dr. Rais Hakim;0838-4929-6510;
35144152;35;Jawa Timur;14;3514;Pasuruan;4;Dokter Praktek Mandiri;152;dr. DANANG ADITYA;Pojkecik, Baujeng, Beji;0812-5255-5527;dr. Danang Aditya;0812-5255-5527;
35144153;35;Jawa Timur;14;3514;Pasuruan;4;Dokter Praktek Mandiri;153;dr.NURUDDIN DZULKARNAIN;;;;;
35144154;35;Jawa Timur;14;3514;Pasuruan;4;Dokter Praktek Mandiri;154;dr. MOCHAMAD IRFAN HANAFI;;;;;
35144155;35;Jawa Timur;14;3514;Pasuruan;4;Dokter Praktek Mandiri;155;dr. MOCH. ZAINUN, Sp.P.FISR;Diwet, Pogar, Kec. Bangil, Pasuruan;0816-1585-9345;dr. Moch. Zainun, Sp.P.FISR;0816-1585-9345;
35144156;35;Jawa Timur;14;3514;Pasuruan;4;Dokter Praktek Mandiri;156;dr. AGUS SUBRONTO;Nongkojajar, kec. tutur;;;;
35144157;35;Jawa Timur;14;3514;Pasuruan;4;Dokter Praktek Mandiri;157;dr. SYAHAR GUNAWAN;Purwosari;;;;
35144157;35;Jawa Timur;14;3514;Pasuruan;4;Dokter Praktek Mandiri;157;dr. Novi;Sangkapura;;;;
35146001;35;Jawa Timur;14;3514;Pasuruan;6;Laboratorium;001;LABKESDA KAB. PASURUAN;Jl. DR. Wahidin Sudiro Husodo No. 24 Kel. Petamanan Kec. Panggungrejo - Pasuruan;0343-424260;dr. Inayati;;
35146002;35;Jawa Timur;14;3514;Pasuruan;6;Laboratorium;002;LABORATORIUM KLINIK PRIMA PANDAAN;Jl. Raya Kemisik RT 01 RW 05, Sumbergedang, Kec. Pandaan, Kab. Pasuruan;0343 631998;dr. Citra Indah Setyaningrum, Sp. PK;;
35146003;35;Jawa Timur;14;3514;Pasuruan;6;Laboratorium;003;LABORATORIUM KLINIK TANJUNG GEMPOL;Jl. Raya Tanjung No. 16 B Gempol;0343 642624;dr. Novita Hermayanti;;
35146004;35;Jawa Timur;14;3514;Pasuruan;6;Laboratorium;004;LABORATORIUM KLINIK TANJUNG PANDAAN;Jl. Raya Kasri No. 448 Pandaan;0343 632948;dr. Agung Nur Sasongko;;
35146005;35;Jawa Timur;14;3514;Pasuruan;6;Laboratorium;005;LABORATORIUM KLINIK SAFIRAH;Jl. Tongkol No. No. 44 Bangil Kab. Pasuruan;0343 741898;dr. Fitri Agustin;;
35146006;35;Jawa Timur;14;3514;Pasuruan;6;Laboratorium;006;LABORATORIUM KLINIK ERBA HUSADA;Jl. A Yani No. 370 Pandaan;0343 631452;dr. Dwi Rizkiyatus Syakinah;;
35146007;35;Jawa Timur;14;3514;Pasuruan;6;Laboratorium;007;LABORATORIUM KLINIK JATI LUHUR;Jl. Raya Surabaya - Malang Km. 45 Jetak, Desa Karangjati Kec. Pandaan, Kab. Pasuruan;82140143997;dr. Rima Aurelia, Sp.PK;;
35146008;35;Jawa Timur;14;3514;Pasuruan;6;Laboratorium;008;Laboratorium Labkesda;Jl. dr Wahidin Sudiro Husodo No. 102;;Ratna;81230996441;
35151001;35;Jawa Timur;15;3515;Sidoarjo;1;Rumah Sakit;001;RS Arafah Anwar Medika Sukodono;Jl. Raya Dungus Jl. Sawo No.2, Sukadono, Sukodono 61258;(031) 8830989;inda Nur Mufida;8,3857E+11;
35151002;35;Jawa Timur;15;3515;Sidoarjo;1;Rumah Sakit;002;RS Bantuan 05.08.03 Sidoarjo;JL DR SOETOMO NO 2 SIDOARJO;318964610;dini;89616072337;
35151003;35;Jawa Timur;15;3515;Sidoarjo;1;Rumah Sakit;003;RS Ibu dan Anak Buah Delima;Jl. Sunandar Priyo Sudarmo No.154, Kuthuk, Sidokare;(031) 8056911;rizky naurah f;82143391804;
35151004;35;Jawa Timur;15;3515;Sidoarjo;1;Rumah Sakit;004;RS Ibu dan Anak Kirana;Jl. Raya Ngelom No.87, Ngelom, Kec. Taman;(031) 7873010;Nur Etik;85648305227;
35151005;35;Jawa Timur;15;3515;Sidoarjo;1;Rumah Sakit;005;RS Ibu dan Anak Mitra Husada;Jl. Raya Sruni No.159, Dusun Sruni, Sruni, Kec. Gedangan 61254;(031) 8918383;Nur Lailatul Evi Yanti;85649606454;
35151006;35;Jawa Timur;15;3515;Sidoarjo;1;Rumah Sakit;006;RS Ibu dan Anak Pondok Tjandra;Perumahan, Pd. Candra, Jl. Mangga I No.E-225, Tambaksumur, Kec. Waru;(031) 8664488;Rina;85100416524;
35151007;35;Jawa Timur;15;3515;Sidoarjo;1;Rumah Sakit;007;RS Ibu dan Anak Soerya;Jl. Raya Kalijaten No.11-15, Kalijaten, Kec. Taman 61257;(031) 7885011;ayu farada;85778834568;
35151008;35;Jawa Timur;15;3515;Sidoarjo;1;Rumah Sakit;008;RS Islam Siti Hajar Sidoarjo;Jl. Raden Patah No.70 - 72, Jasem, Bulusidokare;(031) 8921233;yessy apriyanti;81357784568;
35151009;35;Jawa Timur;15;3515;Sidoarjo;1;Rumah Sakit;009;RS Mata Fatma;Jl. Raya Kalijaten No.40, Kalijaten Timur, Kalijaten, Kec. Taman;0858-5390-0715;dr. Dwi, Sp.PK;81234922979;
35151010;35;Jawa Timur;15;3515;Sidoarjo;1;Rumah Sakit;010;RS Mitra Keluarga Pondok Tjandra;Raya Taman Asri Kav DD No 1-8 Waru Sidoarjo 61256;3199691000;Nurlia Hidayatur Rochmah, S.Kep.Ns;85733468991;
35151011;35;Jawa Timur;15;3515;Sidoarjo;1;Rumah Sakit;011;RS Pusura Candi;Jl. Raya Gelam No.34, Gelam, Kec. Candi;(031) 99717449;Nur azizah;82244033820;
35151012;35;Jawa Timur;15;3515;Sidoarjo;1;Rumah Sakit;012;RS Sheila Medika;Jl. Letjen Wahono No.77-79, Sedati Gede, Kec. Sedati;0878-0888-9988;Lutfita;81331086973;
35151013;35;Jawa Timur;15;3515;Sidoarjo;1;Rumah Sakit;013;RS Umum Aisyiyah Siti Fatimah;Jl. Raya Kenongo No.14, Kenongo, Kec. Tulangan, Kabupaten Sidoarjo;(031) 8851840;Eviatus Sholichah, Amd.Kep;85649398610;
35151014;35;Jawa Timur;15;3515;Sidoarjo;1;Rumah Sakit;014;RS Umum Al-Islam H. M. Mawardi;Jl. Kyai Mojo No. 12 A, Jerukgamping, Krian, Sidoarjo;031-8973379;Niken Eka Damayanti, S.Kep.Ns;85730462558;
35151015;35;Jawa Timur;15;3515;Sidoarjo;1;Rumah Sakit;015;RS Umum Aminah;Jl. Soenandar Priyo Sudarmo, Watutulis Utara, Watutulis, Kec. Prambon;0822-1909-5550;Putri;81358309811;
35151016;35;Jawa Timur;15;3515;Sidoarjo;1;Rumah Sakit;016;RS Umum Anwar Medika;Jl. Bypass Krian No.KM. 33, Semawut, Balongbendo, Kec. BalongBendo;(031) 8972052;Puji;85723855556;
35151017;35;Jawa Timur;15;3515;Sidoarjo;1;Rumah Sakit;017;RS Umum Assakinah Medika;Jl. Raya Kebon Agung No.65, Sambang, Kebonagung, Kec. Sukodono;0899-5003-030;Mei Nur F N;8,95802E+11;
35151018;35;Jawa Timur;15;3515;Sidoarjo;1;Rumah Sakit;018;RS Umum Bunda;Jl. Raya Kundi No.70, Kundi, Kepuhkiriman, Kec. Waru;(031) 8668880;Nata;85852229195;
35151019;35;Jawa Timur;15;3515;Sidoarjo;1;Rumah Sakit;019;RS Umum Citra Medika;Jalan Tol Surabaya - Mojokerto No.KM.44, Kramat, Kramat Temenggung, Kec. Tarik;8813361000;Sulfia;85230591570;
35151020;35;Jawa Timur;15;3515;Sidoarjo;1;Rumah Sakit;020;RS Umum Daerah Sidoarjo;Jl. Mojopahit No.667, Sidowayah, Celep, Kec. Sidoarjo;(031) 8960871;Amik nasuchah;817586304;
35151021;35;Jawa Timur;15;3515;Sidoarjo;1;Rumah Sakit;021;RS Umum Daerah Sidoarjo Barat;Jl. Bibis Bunder, Kamera'an, Tambak Kemerakan, Kec. Krian;(031) 89911199;Nunung;85731340604;
35151022;35;Jawa Timur;15;3515;Sidoarjo;1;Rumah Sakit;022;RS Umum Delta Surya;Jl. Pahlawan No.9, Jati, Kec. Sidoarjo, Kabupaten Sidoarjo;031 8962531;Nur Fatmawati;81335309876;
35151023;35;Jawa Timur;15;3515;Sidoarjo;1;Rumah Sakit;023;RS Umum Jasem;Jl. Samanhudi No.85a, Jasem, Bulusidokare;(031) 8962129;Windi;81914797593;
35151024;35;Jawa Timur;15;3515;Sidoarjo;1;Rumah Sakit;024;RS Umum Mitra Keluarga Waru;Jl. Jenderal S. Parman No.8, Krajan Kulon, Waru, Kec. Waru;031 8543111;Yuyun Dewi Nur Azizah;87864260364;
35151025;35;Jawa Timur;15;3515;Sidoarjo;1;Rumah Sakit;025;RS Umum Mitra Sehat Mandiri Sidoarjo;Jl.Raya Krian-Mojokerto KM 3 Tropodo,Krian,sidoarjo;3199891626;Prasetya dia Kusuma ningrum;8113000225;
35151026;35;Jawa Timur;15;3515;Sidoarjo;1;Rumah Sakit;026;RS Umum Prima Husada;Jl. Letjen Suprapto No.3, Kundi, Kepuhkiriman, Kec. Waru;(031) 8672303;FIcky;82231103600;
35151027;35;Jawa Timur;15;3515;Sidoarjo;1;Rumah Sakit;027;RS Umum Pusdik Polri Porong;Jl. Raya Porong No.1, Porong, Kec. Porong;(0343) 856444;ike;81335210937;
35151028;35;Jawa Timur;15;3515;Sidoarjo;1;Rumah Sakit;028;RS Umum Rahman Rahim;Jl. Raya Saimbang No.10, Kebonagung, Kec. Sukodono;(031) 8830010;Feby Wirantika Putri;85719830308;
35151029;35;Jawa Timur;15;3515;Sidoarjo;1;Rumah Sakit;029;RS Umum Siti Khodijah Muhammadiyah Cabang Sepanjan;Jl. Raya Bebekan, RT.02/RW.01, Bebekan;(031) 7881130;Sugiyah;81330429988;
35151030;35;Jawa Timur;15;3515;Sidoarjo;1;Rumah Sakit;030;RS Umum Usada;Jl. Jeruk No.117, Jatiagung, Wage, Kec. Taman;(031) 8539671;Riza;85646758264;
35152001;35;Jawa Timur;15;3515;Sidoarjo;2;Puskesmas;001;BALONGBENDO;Jl. Mayjen Bambang Yuwono no. 11 seduri Balongbendo;031-8976521;Nuril Qiroatul Mufidah;85733755171;
35152002;35;Jawa Timur;15;3515;Sidoarjo;2;Puskesmas;002;BARENGKRAJAN;Desa Barengkrajan Kecamatan Krian;(031)8970408;Livio Pereira da C.;89686248339;
35152003;35;Jawa Timur;15;3515;Sidoarjo;2;Puskesmas;003;BUDURAN;Jalan jawa No.02 Wadungasih Buduran;318967494;RIRIN FATMAWATI;81332371406;
35152004;35;Jawa Timur;15;3515;Sidoarjo;2;Puskesmas;004;CANDI;jl. m ridwan no 5 ds. gelam candi sidoarjo;318963973;arhainun;83854033229;
35152005;35;Jawa Timur;15;3515;Sidoarjo;2;Puskesmas;005;GANTING;Jln Singomenggolo 1 Ganting;318015538;Fifin Ana Diniati;85648879709;
35152006;35;Jawa Timur;15;3515;Sidoarjo;2;Puskesmas;006;GEDANGAN;Jl RAYA JENGGALA NO 74;(031) 99606350;SULASTRI;85607066495;
35152007;35;Jawa Timur;15;3515;Sidoarjo;2;Puskesmas;007;JABON;JL. MAJAPAHIT NO. 02 DUKUHSARI KEC. JABON SIDOARJO;0343 855690;MOH. YUSUF EFENDI, A.Md. Kep;85732536110;
35152008;35;Jawa Timur;15;3515;Sidoarjo;2;Puskesmas;008;KEDUNGSOLO;JL. RAYA KEDUNGSOLO NO 1 PORONG SIDOARJO;(0343) 853089;CHUSNUL CHOTIMAH, A.Md. Kep;85706822980;
35152009;35;Jawa Timur;15;3515;Sidoarjo;2;Puskesmas;009;KEPADANGAN;Jl Raya Kepadangan no 100 tulangan .sidoarjo.jawa timur;031 8854215;VICA RESDIANA, Amd. Kep;81235949387;
35152010;35;Jawa Timur;15;3515;Sidoarjo;2;Puskesmas;010;KREMBUNG;Jalan sungai Kapuas nomer2, Krembung, kecamatan Krembung;318851542;Anjar Puspitawati,Amd. Kep;85645447408;
35152011;35;Jawa Timur;15;3515;Sidoarjo;2;Puskesmas;011;KRIAN;Jl. Setiabudi No.7, RW.9, Krian, Kec. Krian;(031) 8971244;Aisyah Yunitasari, Amd. Kep;82143446725;
35152012;35;Jawa Timur;15;3515;Sidoarjo;2;Puskesmas;012;MEDAENG;Jl. Joyoboyo no. 40 Medaeng.;(031) 8530043;Nurlita Trisillia, A.Md.Kep;82298700892;
35152013;35;Jawa Timur;15;3515;Sidoarjo;2;Puskesmas;013;PORONG;Jl Juwet Utara No 265 Porong Kode Pos 61274;0343 852031;Ariful Rachmad;85732536786;
35152014;35;Jawa Timur;15;3515;Sidoarjo;2;Puskesmas;014;PRAMBON;Jalan raya prambon no.125 prambon kabupaten Sidoarjo;318974735;Norika Wahyunitasari;8113344644;
35152015;35;Jawa Timur;15;3515;Sidoarjo;2;Puskesmas;015;SEDATI;JL. SENOPATI 3-7 BETRO, SEDATI, SIDOARJO;318917452;NUNUNG PRAWICAHYONO;85731340604;
35152016;35;Jawa Timur;15;3515;Sidoarjo;2;Puskesmas;016;SEKARDANGAN;Jl. Wijaya Kusuma No.4, Plipir, Sekardangan;(031) 8962125;BAYU FATUROHMAN, A.Md.Kep;81331792125;
35152017;35;Jawa Timur;15;3515;Sidoarjo;2;Puskesmas;017;SIDOARJO;Jalan.Dr.Soetomo 14 Magersari Sidoarjo;(031) 8921956;EMA YULISFATIN HIDAYAT, A.Md.Kep;81330040786;
35152018;35;Jawa Timur;15;3515;Sidoarjo;2;Puskesmas;018;SIDODADI;Jl.Raya Sudo Sidodadi Candi Sidoarjo, 61271;031 99723500;Dwi Pujo Lestariono;8121674182;
35152019;35;Jawa Timur;15;3515;Sidoarjo;2;Puskesmas;019;SUKODONO;Jl raya Anggaswangi rt 01 rw 01;318831726;Dita Amalia;85735270240;
35152020;35;Jawa Timur;15;3515;Sidoarjo;2;Puskesmas;020;TAMAN;JL.RAYA NGELOM NO.50 TAMAN SIDOARJO;031-7881201;Dhenok LuchytoRini A. Md.Kep;85648984040;
35152021;35;Jawa Timur;15;3515;Sidoarjo;2;Puskesmas;021;TANGGULANGIN;Jl. Raya Putat No 36. Tanggulangin. Sidoarjo;031-8967232;Udkhulis Silmi;85231636337;
35152022;35;Jawa Timur;15;3515;Sidoarjo;2;Puskesmas;022;TARIK;Jln raya kemuning-tarik , Ds.kemuning;318970415;gunawan suprayitno;82231051835;
35152023;35;Jawa Timur;15;3515;Sidoarjo;2;Puskesmas;023;TROSOBO;Jl. Raya Trosobo Taman kab Sidoarjo;(031) 99781533;Ilmiyah Mufidah;88234105714;
35152024;35;Jawa Timur;15;3515;Sidoarjo;2;Puskesmas;024;TULANGAN;Jl. Raya Kemantren;318850743;HERRY WIDYA SULISTYARINI;81331309301;
35152025;35;Jawa Timur;15;3515;Sidoarjo;2;Puskesmas;025;URANGAGUNG;Jl.raya cemengkalang;318950177;NURUL HIDAYATI;81259306593;
35152026;35;Jawa Timur;15;3515;Sidoarjo;2;Puskesmas;026;WARU;Jl. Barito no 1 Wisma Tropodo;(031) 8676643;Sariyah;81332106660;
35152027;35;Jawa Timur;15;3515;Sidoarjo;2;Puskesmas;027;WONOAYU;Jl. Raya Wonoayu No.1, Popoh, Jimbaran Kulon, Kec. Wonoayu;(031) 8976920;DWI PANGKI PRABOWO, A.Md.Kep;89530450833;
35152028;35;Jawa Timur;15;3515;Sidoarjo;2;Puskesmas;028;WONOKASIAN;Dukuh, Wonokasian, Wonoayu;;Syamsul Arif;85807183229;
35152029;35;Jawa Timur;15;3515;Sidoarjo;2;Puskesmas;029;TAMBAKREJO;Jl. Tambak Sari No.8, Tambaksari, Tambakrejo, Kec. Waru;;Fifi;85156420886;
35152030;35;Jawa Timur;15;3515;Sidoarjo;2;Puskesmas;030;TARIK II;Jl Raya Pasar, Tarik Lor, Tarik, Kec. Tarik, Kabupaten Sidoarjo;0882-2833-0752;dr Okta;85790319888;
35153001;35;Jawa Timur;15;3515;Sidoarjo;3;Klinik;001;AFFAN AFRIN;;;;;
35153002;35;Jawa Timur;15;3515;Sidoarjo;3;Klinik;002;AL HIDAYAH;Jalan Raya No.48, Karangpoh, Ponokawan, Kec. Krian;(031) 8971020;Nurul Laila;85648808027;
35153003;35;Jawa Timur;15;3515;Sidoarjo;3;Klinik;003;ALAMANDA;;;;;
35153004;35;Jawa Timur;15;3515;Sidoarjo;3;Klinik;004;ALITA MEDIKA;Jl. Raya Balongbendo No.17, Suwaluh Utara, Suwaluh;031 8984187;dr. Gifara;85608633592;
35153005;35;Jawa Timur;15;3515;Sidoarjo;3;Klinik;005;ANAINA;;;;;
35153006;35;Jawa Timur;15;3515;Sidoarjo;3;Klinik;006;ANUGERAH KARYA MEDIKA;Ruko Puri Indah Blok RK No. 30, Jalan Jati, Cemeng Kalang, Kec. Sidoarjo;(031) 8070206;Hendrik;82230254569;
35153007;35;Jawa Timur;15;3515;Sidoarjo;3;Klinik;007;ASHABUL KAHFI 60;blok A5,, Jl. Merbabu, Kundi, Kepuhkiriman, Kec. Waru;(031) 8666334;Siti Sofiyah;82228534600;
35153008;35;Jawa Timur;15;3515;Sidoarjo;3;Klinik;008;AZQIARA KLINIK CANTIK MUSLIMAH;;;;;
35153009;35;Jawa Timur;15;3515;Sidoarjo;3;Klinik;009;B CLINIC;Jl. Raya Masangan Wetan - Sukodono, Sikep, Keboansikep, Kec. Gedangan;(031) 8913426;Endah;87840387917;
35153010;35;Jawa Timur;15;3515;Sidoarjo;3;Klinik;010;BILLAGIO SKINCARE CLINIC;;;;;
35153011;35;Jawa Timur;15;3515;Sidoarjo;3;Klinik;011;BILQIS AESTHETIC CLINIC;;;;;
35153012;35;Jawa Timur;15;3515;Sidoarjo;3;Klinik;012;BP CANDI TNI AL;Area Sawah, Sugihwaras, Kec. Candi, Kabupaten Sidoarjo;;Juliana;82234401196;
35153013;35;Jawa Timur;15;3515;Sidoarjo;3;Klinik;013;BP POLIKLINIK WATU TULIS;Jl. Soenandar Priyo Sudarmo No.273, Watutulis, Prambon;(031) 8986608;Puspita;85730978977;
35153014;35;Jawa Timur;15;3515;Sidoarjo;3;Klinik;014;CHARRA MEDICA AESTHETIC WAGE;;;;;
35153015;35;Jawa Timur;15;3515;Sidoarjo;3;Klinik;015;CHARRA MEDICA UMUM WAGE;;;;;
35153016;35;Jawa Timur;15;3515;Sidoarjo;3;Klinik;016;CHARRA MEDIKA AESTHETIC GADING FAJAR;;;;;
35153017;35;Jawa Timur;15;3515;Sidoarjo;3;Klinik;017;CHARRA MEDIKA UMUM GADING FAJAR;;;;;
35153018;35;Jawa Timur;15;3515;Sidoarjo;3;Klinik;018;CHARRA MEDIKA UTAMA;;;;;
35153019;35;Jawa Timur;15;3515;Sidoarjo;3;Klinik;019;CIKKO PRIMA HUSADA;Jl. Tarik No.43, Semawut, Balongbendo, Kec. Krian;(031) 8977499;dr. luluk;81259239153;
35153020;35;Jawa Timur;15;3515;Sidoarjo;3;Klinik;020;DENTAL CARE H. USMAN;;;;;
35153021;35;Jawa Timur;15;3515;Sidoarjo;3;Klinik;021;DNY;;;;;
35153022;35;Jawa Timur;15;3515;Sidoarjo;3;Klinik;022;DR J HEALTH AND BEAUTY CLINIC;;;;;
35153023;35;Jawa Timur;15;3515;Sidoarjo;3;Klinik;023;DR. W_DYARINI SKIN CARE;;;;;
35153024;35;Jawa Timur;15;3515;Sidoarjo;3;Klinik;024;DR.YUNNANTO YOSEDIPUTRA SP.OG;;;;;
35153025;35;Jawa Timur;15;3515;Sidoarjo;3;Klinik;025;ELLA SKIN CLINIC;;;;;
35153026;35;Jawa Timur;15;3515;Sidoarjo;3;Klinik;026;ERHA SKIN SIDOARJO;;;;;
35153027;35;Jawa Timur;15;3515;Sidoarjo;3;Klinik;027;FATIMAH MEDIKA;Terung Kulon, Terungkulon, Krian, Sidoarjo Regency;0812-5962-3754;Eva Dina;85850357521;
35153028;35;Jawa Timur;15;3515;Sidoarjo;3;Klinik;028;FKTP KLINIK DKT 02 SIDOARJO;Komp. Ruko Sun City, Jl. Pahlawan No.1, Rw6, Sidokumpul;;;;
35153029;35;Jawa Timur;15;3515;Sidoarjo;3;Klinik;029;FKTP PUSDIK GASUM LEMDIKLAT POLRI;Jl. Bhayangkari No.5-36, Juwet, Juwetkenongo, Kec. Porong;;dr Indah Badrorrif'ati;81515510026;
35153030;35;Jawa Timur;15;3515;Sidoarjo;3;Klinik;030;GEO MEDIKA;blok p 7 no., Jl. Brigjend Katamso No.3, Wedoro;0821-3752-2736;iin;85162575910;
35153031;35;Jawa Timur;15;3515;Sidoarjo;3;Klinik;031;GRAHA MEDIKA;Jl. Brigjend Katamso No.7, Belahan, Wedoro, Kec. Waru;(031) 8554910;Tinuk;85600999264;
35153032;35;Jawa Timur;15;3515;Sidoarjo;3;Klinik;032;GRIYA AYU CLARISTA;;;;;
35153033;35;Jawa Timur;15;3515;Sidoarjo;3;Klinik;033;HAYYU SYAR'I SKIN CLINIC;;;;;
35153034;35;Jawa Timur;15;3515;Sidoarjo;3;Klinik;034;HIDAYAH WARU IV;Graha Tirta Raya 1, Jl. Tirta Raya I, Pulosari, Kureksari;(031) 70350252;Dwi Arnan;81333002165;
35153035;35;Jawa Timur;15;3515;Sidoarjo;3;Klinik;035;KARYA HUSADA;Jl. Barengkrajan, Sidorono, Barengkrajan, Kec. Krian;0858-5216-3142;;;
35153036;35;Jawa Timur;15;3515;Sidoarjo;3;Klinik;036;KEPUH MEDIKA;Perumahan Kepuh Permai, Jl. Merbabu No.6, Kundi, Kepuhkiriman,;(031) 8661752;;;
35153037;35;Jawa Timur;15;3515;Sidoarjo;3;Klinik;037;KHARISMA MEDIKA;Jl. Ratu Ayu No.37, Sritanjung, Wage, Kec. Taman;(031) 85585423;Amel;85648351440;
35153038;35;Jawa Timur;15;3515;Sidoarjo;3;Klinik;038;KLINIK 57;Jl. Letjen Sutoyo No.Kav. 6, Krajan Kulon, Waru, Kec. Waru;0856-0000-1457;Intan;81332467312;
35153039;35;Jawa Timur;15;3515;Sidoarjo;3;Klinik;039;KLINIK 63;Jl. K. Hasan Bajuri No.79, Tambak Kidul, Tambakrejo;0816-5440-403;dr Artha;85600001463;
35153040;35;Jawa Timur;15;3515;Sidoarjo;3;Klinik;040;KLINIK AFIYAH;Sikep, Keboansikep, Gedangan, Sidoarjo Regency;;Wulan;85733334154;
35153041;35;Jawa Timur;15;3515;Sidoarjo;3;Klinik;041;KLINIK AL IKHLAS;Jl. Raya Bandara Juanda No.II, Semalang, Semambung, Kec. Gedangan;(031) 8667274;nisfullailli;8179397284;
35153042;35;Jawa Timur;15;3515;Sidoarjo;3;Klinik;042;KLINIK ALFATH;Jl. Raya Panjunan No.156, Ngelom, Sidoarjo;(031) 7878609;;;
35153043;35;Jawa Timur;15;3515;Sidoarjo;3;Klinik;043;KLINIK AL-KAUTSAR;Setro, Prambon, Kec. Prambon;;;;
35153044;35;Jawa Timur;15;3515;Sidoarjo;3;Klinik;044;KLINIK AMELIA;No Jl. Kertorejo No.1, Dusun Keboan, Keboananom, Kec. Gedangan;0812-3049-1049;dr wulan;82244330065;
35153045;35;Jawa Timur;15;3515;Sidoarjo;3;Klinik;045;KLINIK AS SYIFA;Jl. Bhayangkari No.534, Gondang Selatan, Juwetkenongo;(0343) 855169;Emma;83857826758;
35153046;35;Jawa Timur;15;3515;Sidoarjo;3;Klinik;046;KLINIK ASY SYIFA PPDFP;Jl. Raya Sidorejo, Sidorejo;(031) 8971899;ahmad Zunaidzi;85755943911;
