32132036;32;Jawa Barat;13;3213;Subang;2;Puskesmas;036;SERANGPANJANG;Jl Raya Serangpanjang, RT.18/RW.09, Cijengkol, Kec. Serangpanjang, Kabupaten Subang, Jawa Barat 41282;-;Enok Nurjanah;82120298635;
32132037;32;Jawa Barat;13;3213;Subang;2;Puskesmas;037;SUKARAHAYU;Jalan Apel Raya, Subang, Jawa Barat;-;Leni Yuliawati;81321238012;
32132038;32;Jawa Barat;13;3213;Subang;2;Puskesmas;038;TAMBAK DAHAN;Ds. Tambakdahan, Kec. Binong Kab Subang;-;Nunung Kurniasih;85320272292;
32132039;32;Jawa Barat;13;3213;Subang;2;Puskesmas;039;TANJUNGSIANG;JL. Raya No.5, 48138, Tanjungsiang, Kec. Tanjungsiang, Kabupaten Subang, Jawa Barat 83352;-;Uca Sutisna;82217158182;
32132040;32;Jawa Barat;13;3213;Subang;2;Puskesmas;040;TANJUNGWANGI;Desa Tanjung Wangi, Kecamatan Cijambe, Cigadung, Kec. Subang, Kabupaten Subang, Jawa Barat 41211;-;Eva Alviano;8995063042;
32133001;32;Jawa Barat;13;3213;Subang;3;Klinik;001;ALIYA;Kec. Pabuaran Kab.Subang;85759206345;-;-;
32133002;32;Jawa Barat;13;3213;Subang;3;Klinik;002;BUNDA MARYAM;Jalan Raya Jatireja Rt O1 Rw. 02, Jatireja, Compreng, Subang Regency, West Java 41254;0823-1570-3779;-;-;
32133003;32;Jawa Barat;13;3213;Subang;3;Klinik;003;CITRA HAIKAL HUSADA;Dsn. Bungur Gede No.142 Ds.Ciasem Sukahaji, Kec.Ciasem, Kab.Subang;-;Ira Nuryeti;85659019086;
32133004;32;Jawa Barat;13;3213;Subang;3;Klinik;004;HANAN MEDIKA;Jl. Raya Compreng - Subang, Mekarjaya, Compreng, Subang;#ERROR!;Elis;81282002434;
32133005;32;Jawa Barat;13;3213;Subang;3;Klinik;005;INSAN MADANI;JL. Raya Subang-Cikamurang, Km. 10, Padaasih, Kec. Subang, Kabupaten Subang;89629800222;Santi;81320513259;
32133006;32;Jawa Barat;13;3213;Subang;3;Klinik;006;JAGA RAGA;Ds. Mrgaluyu Timur, Gg. 5A, NO.16, Rt.26/ Rw.14;-;Desi Rosa Indah;82318435930;
32133007;32;Jawa Barat;13;3213;Subang;3;Klinik;007;KLINIK ADI WIJAYA;Jl. Kubang Jaran, Kec. Pusakajaya, Kabupaten Subang;-;Nadya;89697965553;
32133008;32;Jawa Barat;13;3213;Subang;3;Klinik;008;KLINIK AIDA;Jl. D. Kartawigenda Gg. Palabuan No.84, Cigadung, Kec. Subang,;-;Tela;81944049987;
32133009;32;Jawa Barat;13;3213;Subang;3;Klinik;009;KLINIK ANNAML MEDIKA;Jl. Ahmad Yani No.92 Kel. Pasirkareumbi, Kec. Subang;0877-2665-3922;Ahmad Sahrubi;87724441209;
32133010;32;Jawa Barat;13;3213;Subang;3;Klinik;010;KLINIK ANUGRAH SEHAT;Jl. Ciasem Blanakan No 21;818429007;Sri megawati;82318435930;
32133011;32;Jawa Barat;13;3213;Subang;3;Klinik;011;KLINIK ASHIQA;Jl. Raya Purwadadi, Blok sekolah Rt.22/ Rw.05, Purwadadi;85316055077;-;-;
32133012;32;Jawa Barat;13;3213;Subang;3;Klinik;012;KLINIK BHAKTI ASIH;Dusun Tanjung sari, Rt.05/ Rw.01, Desa Blanakan;260510008;Dimas;85883460029;
32133013;32;Jawa Barat;13;3213;Subang;3;Klinik;013;KLINIK BHAYANGKARA POLRES SUBANG;JL. OTISTA NO 118 SUBANG;811117301;Edwin;81395480881;
32133014;32;Jawa Barat;13;3213;Subang;3;Klinik;014;KLINIK BUANA SYIFA;Citrajaya, Kec.Binong, Kab.Subang;-;-;-;
32133015;32;Jawa Barat;13;3213;Subang;3;Klinik;015;KLINIK GLOBAL MEDICAL CENTER;Jl. Pejuang 45 Rt.048, Rw.013, Karanganyar, Subang;-;dr. Dede Firdhous;81382910331;
32133016;32;Jawa Barat;13;3213;Subang;3;Klinik;016;KLINIK HADI HUSADA;Griya Cinangsi Asri, Blok A, No.8, Ds Cinangsi, Cibogo;82316503535;Dhestya;85315400072;
32133017;32;Jawa Barat;13;3213;Subang;3;Klinik;017;KLINIK HAJI MASITOH;Tambakjati, Kec. Patokbeusi, Kabupaten Subang;-;-;-;
32133018;32;Jawa Barat;13;3213;Subang;3;Klinik;018;KLINIK HARAPAN BUNDA;Jl. Kadalangan, koranji, kec.Purwadadi, Kab.Subang;-;-;-;
32133019;32;Jawa Barat;13;3213;Subang;3;Klinik;019;KLINIK JAMILAH;Kp. Saluyu Rt.19/Rw.05, Desa Tanggulun Timur;82218929025;-;-;
32133020;32;Jawa Barat;13;3213;Subang;3;Klinik;020;KLINIK JANTUNG HASNA MEDIKA SUBANG;Jl. Kapten Hanafiah, Karanganyar, Kec. Subang;82115904922;Nadya;82120501154;
32133021;32;Jawa Barat;13;3213;Subang;3;Klinik;021;KLINIK JASA KARTINI SUBANG;Jl. Otto Iskandardinata No.69, Karanganyar,Kec.Subang;81220133567;-;-;
32133022;32;Jawa Barat;13;3213;Subang;3;Klinik;022;KLINIK KALIJATI;Jl. Raya Kalijati Kec.Kalijati Kab.Subang;-;Mira;81313753108;
32133023;32;Jawa Barat;13;3213;Subang;3;Klinik;023;KLINIK KORPRI;Jl. Otto Iskandardinata, Karananyar,Kec.Subang;-;-;-;
32133024;32;Jawa Barat;13;3213;Subang;3;Klinik;024;KLINIK MAHARDIKA CENTER PAGADEN;Gunung Sembung;-;Januar Pradipta;85846569622;
32133025;32;Jawa Barat;13;3213;Subang;3;Klinik;025;KLINIK MEDDILA HUSADA;dusun patrol RT 19 RW 06 tambak mekar;-;;;
32133026;32;Jawa Barat;13;3213;Subang;3;Klinik;026;KLINIK MITRA MEDIKA TAMBAKAN;Talaga Indah, Tambakan, Kec. Jalancagak, Kabupaten Subang;#ERROR!;Meinawati;82240341114;
32133027;32;Jawa Barat;13;3213;Subang;3;Klinik;027;KLINIK MITRA SIAGA;Jl. Kp. Bojong No.28, cilamaya Girang, Kec. Blanakan;(0264) 8380943;dr. Aang;8127933367;
32133028;32;Jawa Barat;13;3213;Subang;3;Klinik;028;KLINIK NURUL INAYAH;Jl. Duren Raya Perumnas Blok 5, Sukamelang;-;;;
32133029;32;Jawa Barat;13;3213;Subang;3;Klinik;029;KLINIK PRATAMA AULIA HUSADA;Jl. Sompi No.33 Purwasari, Cigadung Subang;-;dr. Douven;81321270615;
32133030;32;Jawa Barat;13;3213;Subang;3;Klinik;030;KLINIK PRATAMA BIMA MEDIKA;Jl. Pasanggrahan No.18,Sindangsari, kec.kasomalang, Kab.Subang;81318575510;-;-;
32133031;32;Jawa Barat;13;3213;Subang;3;Klinik;031;KLINIK PRATAMA DEWI UTAMA SENTOSA;Jl. Raya Bunihayu, Bunihayu, Kec. Jalancagak, Kabupaten Subang;-;Abdul Latif;85220418432;
32133032;32;Jawa Barat;13;3213;Subang;3;Klinik;032;KLINIK PRATAMA DOKTER MAYA;Jl. Raya Lamaran-Compreng, Jatireja, Kec.Compreng Kab.Subang;-;dr. Maya;82364487111;
32133033;32;Jawa Barat;13;3213;Subang;3;Klinik;033;KLINIK PRATAMA FINA MEDIKA;Kp. Jabong, Rt.19/Rw.06, Ds. Curug rendeng, Kec. Jalancagak;-;-;-;
32133034;32;Jawa Barat;13;3213;Subang;3;Klinik;034;KLINIK PRATAMA KIMIA FARMA SUBANG;Jl. Otto Iskandardinata No.199, Karanganyar, kec.Subang, Kab. Subang;-;-;-;
32133035;32;Jawa Barat;13;3213;Subang;3;Klinik;035;KLINIK PRATAMA RAWAT INAP AZKIA;kp. cikalong Rt.035, Rw.008, Ds. Jabong, Kec. Pagaden;81310122480;Novita;81320085700;
32133036;32;Jawa Barat;13;3213;Subang;3;Klinik;036;KLINIK PRATAMA RAWAT INAP EMMALIA HUSADA;Rawameneng Rt.04/ Rw.01, Kec. Blanakan;-;dr. Hilda;85223142674;
32133037;32;Jawa Barat;13;3213;Subang;3;Klinik;037;KLINIK PRATAMA RAWAT INAP MEDIKA INSANI;Jl. Raya Binong No.1, Kediri, Kec. Binong, Kabupaten Subang;-;Novi;83822028816;
32133038;32;Jawa Barat;13;3213;Subang;3;Klinik;038;KLINIK PRATAMA RAWAT INAP MELODY;Ds, Warung Nangka, Rt.03/ Rw.05, Ds. Ciasem baru;-;-;-;
32133039;32;Jawa Barat;13;3213;Subang;3;Klinik;039;KLINIK PRATAMA RAWAT INAP MITRA SEHAT;Jl. Raya Pabuaran - Cipeundeuy, Kp. Sadang Rt.40/ Rw.13, Desa Salamjaya;-;Didi;87741692811;
32133040;32;Jawa Barat;13;3213;Subang;3;Klinik;040;KLINIK PRATAMA RAWAT INAP NURUSSYIFA;Sawangan, Kec. Cipeundeuy, Kabupaten Subang;85222667735;Rizky;82127120266;
32133041;32;Jawa Barat;13;3213;Subang;3;Klinik;041;KLINIK PRATAMA RAWAT INAP SABILA;Jalan Sudarjo No.31, Kasomalang Wetan, Kec. Kasomalang, Kabupaten Subang;-;Bd. Novi;85315757697;
32133042;32;Jawa Barat;13;3213;Subang;3;Klinik;042;KLINIK PRATAMA SALSABILA;Kp. Cicariu Mrgaluyu, Rt.018/ Rw.003, Desa Bunihayu, Kec. Jalan Cagak;81320229789;-;-;
32133043;32;Jawa Barat;13;3213;Subang;3;Klinik;043;KLINIK RAIHAN HUSADA;Dusun Blendung IV RT 24/07, Ds. Blendung, Kec Purwadadi, Kab Subang;-;-;-;
32133044;32;Jawa Barat;13;3213;Subang;3;Klinik;044;KLINIK RAJA MEDICAL CENTER;Jl. Raya Tanjungwangi No.25, Cijambe, Subang;-;-;-;
32133045;32;Jawa Barat;13;3213;Subang;3;Klinik;045;KLINIK RAWAT INAP KARIR BAROKAH;Jln Pertamina KM01, Tanjungsalep, Jatimulya, Kec. Compreng, Kabupaten Subang;85159790062;-;-;
32133046;32;Jawa Barat;13;3213;Subang;3;Klinik;046;KLINIK SANTOSA;Jl. Raya Subang - Sadang Kp. Cijoged Desa Lengkong RT.5/RW.2;-;Irfan;83160239605;
32133047;32;Jawa Barat;13;3213;Subang;3;Klinik;047;KLINIK SERANG SEHAT;Kp. Cijengkol, Serang panjang;-;dr. Andri;81321844066;
32133048;32;Jawa Barat;13;3213;Subang;3;Klinik;048;KLINIK SHINTA;Jl. Karihkil, RT.02/RW.01, Kasomalang Kulon, Kasomalang;-;-;-;
32133049;32;Jawa Barat;13;3213;Subang;3;Klinik;049;KLINIK SUKAJAYA;Kp. Sukajaya RT 18/09 Wanakerta, kec.Purwadadi, Kab.Subang;-;-;-;
32133050;32;Jawa Barat;13;3213;Subang;3;Klinik;050;KLINIK UTAMA MEDIKA FARMA;Jl. Otto Iskandardinata No.126, Karanganyar, Kec. Subang, Kabupaten Subang, Jawa Barat 41215;-;Ulfa;81320744574;
32133051;32;Jawa Barat;13;3213;Subang;3;Klinik;051;KLINIK UTAMA PANGADANGAN;JL. ION MARTASASMITA NO. 95;-;-;-;
32133052;32;Jawa Barat;13;3213;Subang;3;Klinik;052;KLINIK PRATAMA ASSYIFA MEDIKA;Tambakan, Kec.Jalancagak, Kab.Subang;-;Puri;85221688360;
32133053;32;Jawa Barat;13;3213;Subang;3;Klinik;053;KP AMALIA LAKSONO;Jl. Pelabuhan Sukamelang, Kec. Subang;-;Rini;82120919146;
32133054;32;Jawa Barat;13;3213;Subang;3;Klinik;054;KP ANGKASA;Jl. Marengmang, Kalijati;-;drg. Ilmi;81222229687;
32133055;32;Jawa Barat;13;3213;Subang;3;Klinik;055;KP CAHAYA MEDIKA INSANI;Jl. Raya Cinangsi No. 4 Rt. 005/002 Kec. Cibogo Subang;-;Nia Mulyasari;85294104077;
32133056;32;Jawa Barat;13;3213;Subang;3;Klinik;056;KP ECO MEDICA CENTER;Jl. Raya Cieupendeuy, Cipeundeuy Rt. 18, Rw.06, Kec. Cipeundeuy;-;Rizal;81313809371;
32133057;32;Jawa Barat;13;3213;Subang;3;Klinik;057;KP ELVIAN;Jl. Raya Rancabango, Rancabango, Kec. Patokbeusi;-;Iyad;89637628369;
32133058;32;Jawa Barat;13;3213;Subang;3;Klinik;058;KP HABIE MEDIKA;Jl. Pagaden - Haurgeulis No.2, Jati, Kec. Cipunagara;-;Eva;81322932236;
32133059;32;Jawa Barat;13;3213;Subang;3;Klinik;059;KP LARASATI;Jl. Baru Kalijati, Kp.Babakan Bandung selatan, kec.kalijati, kab.subang;-;-;-;
32133060;32;Jawa Barat;13;3213;Subang;3;Klinik;060;KP NUR INSAN;Jl. Raya Gambarsari, Kp. Mekarsari Rt.06/ Rw.02, Ds. Gambarsari, Kec. Pagaden, Kab. Subang;-;Mouddy;85320416509;
32133061;32;Jawa Barat;13;3213;Subang;3;Klinik;061;KP TRIA MEDIKA;Jl. Raya Belendung No. 45, Belendung, Cibogo;-;Holish;82121623647;
32133062;32;Jawa Barat;13;3213;Subang;3;Klinik;062;MITRA MEDIKA ABADI;Jl. Kapten Hanafiah No.3, Karanganyar, Kec. Subang, Kabupaten Subang;-;Tika;82216849773;
32133063;32;Jawa Barat;13;3213;Subang;3;Klinik;063;NAUFAL HUSADA;Kp.Ciparay,Kec.Pabuaran,Kab.Subang;-;-;-;
32133064;32;Jawa Barat;13;3213;Subang;3;Klinik;064;NUR ICHSAN;Kp. Karang Tanung Rt.03/ Rw.01, Desa Mekarsari, Kec. Cikaum;85222341556;-;-;
32133065;32;Jawa Barat;13;3213;Subang;3;Klinik;065;POS KESEHATAN 03.10.05 SUBANG;Jl. Mayjen Sutoyo No.27 Kab.Subang;-;Bd. Cendy;85221579184;
32133066;32;Jawa Barat;13;3213;Subang;3;Klinik;066;PURI KASIH;Jl. Rawagebang No.7, Ciberes, Kec. Patokbeusi, Kabupaten Subang;-;-;-;
32133067;32;Jawa Barat;13;3213;Subang;3;Klinik;067;PUTRA AULIAN;Sindang Rt.017/Rw.004, Desa Jati, Kec. Cipunagara;-;Aindin;83823084328;
32133068;32;Jawa Barat;13;3213;Subang;3;Klinik;068;RNA MEDIKA;Jl. Palasari Dua - Babakan Gn., Palasari, Kec. Ciater;87758108555;-;-;
32133069;32;Jawa Barat;13;3213;Subang;3;Klinik;069;SUBUR JAYA;Salamjaya, Kec. Pabuaran, Kab.Subang;-;-;-;
32133070;32;Jawa Barat;13;3213;Subang;3;Klinik;070;WARSITO MEDIKA;Jl Bojong Loa Desa, Pabuaran;-;Eli P;85317788843;
32133071;32;Jawa Barat;13;3213;Subang;3;Klinik;071;LAPAS KELAS II A SUBANG;Jl. Palabuan No. 03, Sukamelang, Subang;-;Asep;8122457045;
32133072;32;Jawa Barat;13;3213;Subang;3;Klinik;072;KLINIK NURIDA;Jl. Parung Girang Kab.Subang;-;dr. Susilawati;81395718991;
32133073;32;Jawa Barat;13;3213;Subang;3;Klinik;073;KLINIK PRATAMA HIDAYATULLAH;Jl. Raya Jungklang, Binong, Kec. Binong, Kabupaten Subang;-;dr. Nandang;85315080909;
32133074;32;Jawa Barat;13;3213;Subang;3;Klinik;074;KLINIK PRATAMA BLANAKAN;Jl. Raya Blanakan, RT.006/RW.001, Blanakan;-;Esa Agesti;85793748042;
32133075;32;Jawa Barat;13;3213;Subang;3;Klinik;075;KLINIK PT TK INDUSTRIAL INDONESIA /PT TAEKWANG;Jl. Raya Cinangsi, Cibogo;-;dr. Ardyan;8122034423;
32133076;32;Jawa Barat;13;3213;Subang;3;Klinik;076;KLINIK PRATAMA ASSYFA WANAREJA;Blok Lw. Peuris RT/RW 07/02, Wanareja, Kec. Subang, Kabupaten Subang,;-;-;-;
32133077;32;Jawa Barat;13;3213;Subang;3;Klinik;077;KLINIK PRATAMA BELENDUNG;Jl. Belendung - Cibogo;-;dr. Zaenal;82128089613;
32133078;32;Jawa Barat;13;3213;Subang;3;Klinik;078;KLINIK PRATAMA SIDAJAYA MEDIKA;Cipunagara;-;Fajar;83808922237;
32133079;32;Jawa Barat;13;3213;Subang;3;Klinik;079;KLINIK PRATAMA DR JUJUR;Parigimulya, Kec. Cipunagara, Kabupaten Subang;-;dr. jujur;81912608648;
32133080;32;Jawa Barat;13;3213;Subang;3;Klinik;080;KLINIK PRATAMA QUINSHA MEDIKA;Jl. Raya Pantura No.24, Kebondanas, Kec. Pusakajaya;-;Ika;8382382871;
32133081;32;Jawa Barat;13;3213;Subang;3;Klinik;081;KLINIK PRATAMA LA TANSA;Kampung Panembong, RT.01/RW.01, Tenjolaya, Kec. Kasomalang, Kabupaten Subang;-;Puja;82240796666;
32133082;32;Jawa Barat;13;3213;Subang;3;Klinik;082;KLINIK PRATAMA RANGGANING HUSADA;Jl. Sengon, Tambakjati, Kec. Patokbeusi, Kabupaten Subang;8122384441;-;-;
32133083;32;Jawa Barat;13;3213;Subang;3;Klinik;083;KLINIK PRATAMA HIKMAH HUSADA;Patokbeusi;-;-;-;
32133084;32;Jawa Barat;13;3213;Subang;3;Klinik;084;KLINIK PRATAMA KIYANDRA;Jl. Raya Purwadadi Barat No 108;-;D.Suhwa F;87828723036;
32133085;32;Jawa Barat;13;3213;Subang;3;Klinik;085;KLINIK PRATAMA BUNDA MUTIARA;Blok sakola, RT.22/RW.05, Purwadadi Bar., Kec. Purwadadi, Kabupaten Subang;-;-;-;
32133086;32;Jawa Barat;13;3213;Subang;3;Klinik;086;KLINIK PRATAMA SINAR WINAYA;Jl. Raya Sagalaherang, Subang No.21;-;Wulan Riyusman;85315868410;
32133087;32;Jawa Barat;13;3213;Subang;3;Klinik;087;KLINIK PRATAMA SEHAT ABADI;Jl. Sagalaherang Subang, Sagalaherang Kaler, Kec. Sagalaherang, Kabupaten Subang;-;dr. Noventy;85322198334;
32133088;32;Jawa Barat;13;3213;Subang;3;Klinik;088;KLINIK PRATAMA HAPPY HEALTHY;Kertajaya - Tambak Dahan;81222630600;Irdansyah;81246940808;
32133089;32;Jawa Barat;13;3213;Subang;3;Klinik;089;KLINIK SYAILENDRA MEDIKA;Jl. Raya Tanjungsiang No.18, Tanjungsiang, Kabupaten Subang;-;-;-;
32133090;32;Jawa Barat;13;3213;Subang;3;Klinik;090;KLINIK PRATAMA HERLINA;Jl. Cikaramas, Cikawung, Kec. Tanjungsiang, Kabupaten Subang;-;Neni Herlina;85221828828;
32133091;32;Jawa Barat;13;3213;Subang;3;Klinik;091;KLINIK dr NOERMAN;Jl. Banteng, Ciasem Girang;82121255052;-;-;
32133092;32;Jawa Barat;13;3213;Subang;3;Klinik;092;KLINIK PRATAMA DR SARI;Binong;;;;
32133093;32;Jawa Barat;13;3213;Subang;3;Klinik;093;KLINIK DR ADE WAWAN;Jl. Cikaum, Kp. Krajan;-;-;-;
32133094;32;Jawa Barat;13;3213;Subang;3;Klinik;094;KLINIK DINAR SEHAT;JL. PARUNG;;;;
32133095;32;Jawa Barat;13;3213;Subang;3;Klinik;095;KLINIK HANIFAH MEDIKA;Jln.Dangdeur;;;;
32133096;32;Jawa Barat;13;3213;Subang;3;Klinik;096;KLINIK NURUL ILHAM;DANGDEUR;;;;
32133097;32;Jawa Barat;13;3213;Subang;3;Klinik;097;KLINIK RAHAYU MEDIKA;Sumurgintung, Pagaden Barat;;;;
32133098;32;Jawa Barat;13;3213;Subang;3;Klinik;098;KLINIK Dr.SUWITO B. MUSHA;Rawameneng, Kec. Blanakan, Kabupaten Subang;-;dr. Suwito B.Musha;81906350075;
32133099;32;Jawa Barat;13;3213;Subang;3;Klinik;099;KLINIK KURNIA;Pusakaratu, Kec. Pusakanagara, Kabupaten Subang, Jawa Barat 41255;;;;
32133100;32;Jawa Barat;13;3213;Subang;3;Klinik;100;KLINIK SADAWIRA;Tanjungsiang;81234586505;;;
32134001;32;Jawa Barat;13;3213;Subang;4;Dokter Praktek Mandiri;001;ABDUL MAZID ZABIR, DR;Sukawera, RT 17/05 Mekarjaya kec,Compreng, Kab.Subang;-;-;-;
32134002;32;Jawa Barat;13;3213;Subang;4;Dokter Praktek Mandiri;002;ADRIANA PRAPTININGSIH ,DR;Jl. Ciawitali, Dusun Pusakajati;-;dr. Adriana;81395558567;
32134003;32;Jawa Barat;13;3213;Subang;4;Dokter Praktek Mandiri;003;ALMA LUCYATI ,DR;Jl. Ion Martasasmita Subang;-;-;-;
32134004;32;Jawa Barat;13;3213;Subang;4;Dokter Praktek Mandiri;004;ANDRIYANO, DR;Jl. Raya Cidahu No.09 Subang;-;-;-;
32134005;32;Jawa Barat;13;3213;Subang;4;Dokter Praktek Mandiri;005;BACHTIAR RIVAI ,DR;Jl. Raya tanjungrasa 49 Subang;-;dr. Bachtiar;81369402727;Apotek Anisa patokbeusi
32134006;32;Jawa Barat;13;3213;Subang;4;Dokter Praktek Mandiri;006;CHAERUDDIN,.H., DR.M.KES;Jl. Raya Gunungsembung, Kec. Pagaden,;-;dr. Chaeruddin;82317885468;
32134007;32;Jawa Barat;13;3213;Subang;4;Dokter Praktek Mandiri;007;DADANG DIMAS SARI UTOMO,DR;Jl. Purwadadi No.9 Subang;-;-;-;
32134008;32;Jawa Barat;13;3213;Subang;4;Dokter Praktek Mandiri;008;DIAN WIDYA.,R.A.,DR;Sukakerti, Kec. Cisalak, Kabupaten Subang,;-;-;-;
32134009;32;Jawa Barat;13;3213;Subang;4;Dokter Praktek Mandiri;009;DODING SAEFUDIN. DR;Ds. Dukuh Tengah, Jatibaru;-;dr. Doding;85781624242;
32134010;32;Jawa Barat;13;3213;Subang;4;Dokter Praktek Mandiri;010;ELAN, DR;Pringkasap;-;dr. Elan;85224093409;
32134011;32;Jawa Barat;13;3213;Subang;4;Dokter Praktek Mandiri;011;ELEN AGUSTIANI, DR;Jl. Raya Pramuka, Sukamelang, Kec. Subang;-;dr Elen;82218605211;
32134012;32;Jawa Barat;13;3213;Subang;4;Dokter Praktek Mandiri;012;ENCEP SUGIANA ,DR;Komp.PDK Jl. Ki Hajar Dewantara No.77 Subang;-;-;-;
32134013;32;Jawa Barat;13;3213;Subang;4;Dokter Praktek Mandiri;013;FITRI SUMIYATI ,DR;Pagaden Barat;-;dr. Fitri;81320007892;
32134014;32;Jawa Barat;13;3213;Subang;4;Dokter Praktek Mandiri;014;GUSRI AMELIA, DR;Karanganyar, Kab.Subang;-;dr. Gusri Amelia;82125622196;
32134015;32;Jawa Barat;13;3213;Subang;4;Dokter Praktek Mandiri;015;ICA SYAFITRI KOMARIAH, DR;Blok Dangdeur No.87 Subang;-;-;-;
32134016;32;Jawa Barat;13;3213;Subang;4;Dokter Praktek Mandiri;016;INDRA BAGUS HARYANTO, DR;Tanjungsiang;-;-;-;
32134017;32;Jawa Barat;13;3213;Subang;4;Dokter Praktek Mandiri;017;JAN RUDI ISKANDAR,H.,M.KES.,DR;Jambe Anom Subang;-;dr. Jan Rudi;81220619886;
32134018;32;Jawa Barat;13;3213;Subang;4;Dokter Praktek Mandiri;018;JAYADI. DR;Jl. Kp.Krajan Kab.Subang;-;-;-;
32134019;32;Jawa Barat;13;3213;Subang;4;Dokter Praktek Mandiri;019;JULIE TRIANA, DR.;Jl. Raya Alun- Alun Barat Subang;-;-;-;
32134020;32;Jawa Barat;13;3213;Subang;4;Dokter Praktek Mandiri;020;LENI HERLINA, DR;Jl. Raya Pagaden, Kab.Subang;-;dr. Leni;81220065099;
32134021;32;Jawa Barat;13;3213;Subang;4;Dokter Praktek Mandiri;021;MAXI, DR.,S.H., MH.KES;Jl. Raya Tambakdahan Subang;-;-;-;Sudah berubah menjadi klinik Happy Healthy
32134022;32;Jawa Barat;13;3213;Subang;4;Dokter Praktek Mandiri;022;MEITY DAMAYANTI, HJ., DR;Jl. Raya Cipeundeuy Subang;-;dr. meity;81288988663;
32134023;32;Jawa Barat;13;3213;Subang;4;Dokter Praktek Mandiri;023;MOKHAMAD ARIF RAKHMAN. DR;Kp. Gang Hui Kab.Subang;-;-;-;
32134024;32;Jawa Barat;13;3213;Subang;4;Dokter Praktek Mandiri;024;MUGIA NUGRAHA .,MM.,DR;Jl. Kartini No.12 Pasirkareumbi Subang;-;dr. Mugia;811242196;
32134025;32;Jawa Barat;13;3213;Subang;4;Dokter Praktek Mandiri;025;MUHAMMAD ARSYAD .DR;Jl. Raya Cagak Kab.Subang;-;dr. Arsyad;81321698411;
32134026;32;Jawa Barat;13;3213;Subang;4;Dokter Praktek Mandiri;026;NURAL HUDA, DR;-;-;-;-;
32134027;32;Jawa Barat;13;3213;Subang;4;Dokter Praktek Mandiri;027;OYOK, DR.;Jl. Lamaran Kab.Subang;-;-;-;
32134028;32;Jawa Barat;13;3213;Subang;4;Dokter Praktek Mandiri;028;RATNASARI ,DR;Jl. Mariuk Subang;-;-;-;
32134029;32;Jawa Barat;13;3213;Subang;4;Dokter Praktek Mandiri;029;SISKA MAYA SARI, DR;Cipunagara;-;dr. Siska;81313368500;
32134030;32;Jawa Barat;13;3213;Subang;4;Dokter Praktek Mandiri;030;WAHYUNI SUCI WULANDARI, DR;Perum Surya Cigadung B-19 Subang;-;-;-;
32134031;32;Jawa Barat;13;3213;Subang;4;Dokter Praktek Mandiri;031;WAWAN KURNIAWAN, DR;Wantilan, Kec.Cipeundeuy kab Subang;-;dr. Wawan;85966744112;
32134032;32;Jawa Barat;13;3213;Subang;4;Dokter Praktek Mandiri;032;YATNO ARIFINATO ,DR;Tanjungsari, Cikaum , Kab.Subang;-;-;-;
32134033;32;Jawa Barat;13;3213;Subang;4;Dokter Praktek Mandiri;033;IKI IRWANTO,DR;Batangsari;-;dr. iki irwanto;81313513335;
32134034;32;Jawa Barat;13;3213;Subang;4;Dokter Praktek Mandiri;034;M.ROSENO, DR;Jl. Raya pantura, ciasem;-;dr. M. Roseno;81320793508;
32134035;32;Jawa Barat;13;3213;Subang;4;Dokter Praktek Mandiri;035;NOUVEL AZIZ,DR;Jl. Raya Cicadas No.5 RT/RW 02/01, Nanggerang, Kec. Binong, Kabupaten Subang;-;-;-;
32134036;32;Jawa Barat;13;3213;Subang;4;Dokter Praktek Mandiri;036;NURMA FITRI AFRIANI,DR;Dsn. KertamuktI, Raya Blanakan, Blanakan, Kec. Blanakan;-;dr. Nurma;81286977498;
32134037;32;Jawa Barat;13;3213;Subang;4;Dokter Praktek Mandiri;037;AGUS SUSENO,DR;Jl. Ahmad Yani, Ciasem Hilir, Subang;-;-;-;
32134038;32;Jawa Barat;13;3213;Subang;4;Dokter Praktek Mandiri;038;UMAIR,DR;l. Sukamulya Cibogo, Cibogo, Kec. Cibogo;-;dr. Umair;82144098199;
32134039;32;Jawa Barat;13;3213;Subang;4;Dokter Praktek Mandiri;039;INDRIYANTI NOVIYAN,DR;Jl. M.R. Dedeng S No.77, Pasirkareumbi, Kec. Subang, Kabupaten Subang;-;-;;
32134040;32;Jawa Barat;13;3213;Subang;4;Dokter Praktek Mandiri;040;DIKI,DR;Jl. Pasirkareumbi, Subang;-;-;-;
32134041;32;Jawa Barat;13;3213;Subang;4;Dokter Praktek Mandiri;041;AGUS K, DR;Cikaum;-;-;-;
32134042;32;Jawa Barat;13;3213;Subang;4;Dokter Praktek Mandiri;042;SELIK, DR;Jl. Raya Cipeundeuy - Subang;-;-;-;
32134043;32;Jawa Barat;13;3213;Subang;4;Dokter Praktek Mandiri;043;MIA DEWI RAHAYU, DR;Padamulya, Kec. Cipunagara, SUBANG;-;dr Mia;82320004583;
32134044;32;Jawa Barat;13;3213;Subang;4;Dokter Praktek Mandiri;044;KUSNADI SENJAYA,DR;Cipungara, Subang;-;dr. Kusnadi;8122199887;
32134045;32;Jawa Barat;13;3213;Subang;4;Dokter Praktek Mandiri;045;AGUS,DR;Jl. Raya Jatireja, Jatireja, Kec. Compreng, Kab. Subang;-;-;-;
32134046;32;Jawa Barat;13;3213;Subang;4;Dokter Praktek Mandiri;046;AHMAD,DR;Jl. Raya Dawuan - Subang;-;-;-;
32134047;32;Jawa Barat;13;3213;Subang;4;Dokter Praktek Mandiri;047;BUDIONO, DR;Jl. Cagak No.10, Jalancagak, Kec. Jalancagak,;-;-;-;
32134048;32;Jawa Barat;13;3213;Subang;4;Dokter Praktek Mandiri;048;NUNUNG, DR;Jatibaru;-;-;-;
32134049;32;Jawa Barat;13;3213;Subang;4;Dokter Praktek Mandiri;049;MULYADI, DR;Jl. Raya Jatireja - Tambakdahan;-;dr. Mulyadi;8121415151;
32134050;32;Jawa Barat;13;3213;Subang;4;Dokter Praktek Mandiri;050;DIMAS, DR;Jl. Raya Kalijati No.Desa, Kaliangsana, Kec. Kalijati, Kabupaten Subang;-;-;-;-
32134051;32;Jawa Barat;13;3213;Subang;4;Dokter Praktek Mandiri;051;IVON SUSANTI,DR;Kalijati, Subang;-;-;-;
32134052;32;Jawa Barat;13;3213;Subang;4;Dokter Praktek Mandiri;052;ALVIAN, DR;Kalijati, Subang;-;-;-;
32134053;32;Jawa Barat;13;3213;Subang;4;Dokter Praktek Mandiri;053;SATRIYO WIDYANTO,DR;Jl. Raya Kasomalang - Cisalak, Subang;-;-;-;
32134054;32;Jawa Barat;13;3213;Subang;4;Dokter Praktek Mandiri;054;AGUS, DR;Kasomalang, Subang;-;-;-;
32134055;32;Jawa Barat;13;3213;Subang;4;Dokter Praktek Mandiri;055;AJAT RUSTAMAN,DR;RT.8/RW.2, Cimanglid, Kec. Kasomalang, Kab.Subang;-;-;-;
32134056;32;Jawa Barat;13;3213;Subang;4;Dokter Praktek Mandiri;056;YUDHA, DR;RT.01/RW.03, Kasomalang Kulon, Kec. Kasomalang, Kab. Subang,;-;-;-;
32134057;32;Jawa Barat;13;3213;Subang;4;Dokter Praktek Mandiri;057;NONO SUTRISNO, DR;Karangmulya, Kec. Legonkulon, Kabupaten Subang,;-;dr. Nono Sutrisno;82127772333;
32134058;32;Jawa Barat;13;3213;Subang;4;Dokter Praktek Mandiri;058;NUNI RATNA UTAMI,DR;Jl. Raya Legon kulon;-;dr. Nuni Ratna;81320767547;
32134059;32;Jawa Barat;13;3213;Subang;4;Dokter Praktek Mandiri;059;PERDANA, DR;Jl. Mariuk, Kec. Tambakdahan, Kabupaten Subang;-;-;-;
32134060;32;Jawa Barat;13;3213;Subang;4;Dokter Praktek Mandiri;060;R.E JUNIADEVI,DR;Jl. Raya Pabuaran, Subang;-;dr. R.E Juniadevi;83815304224;
32134061;32;Jawa Barat;13;3213;Subang;4;Dokter Praktek Mandiri;061;NISA ARIFIANTI, DR;Jl. Raya Pabuaran, Subang;-;-;-;
32134062;32;Jawa Barat;13;3213;Subang;4;Dokter Praktek Mandiri;062;DENDRUS, DR;Jl. Raya Alun alun Pagaden;-;dr. Indriati Oetama;8112072909;
32134063;32;Jawa Barat;13;3213;Subang;4;Dokter Praktek Mandiri;063;ANGGRAENI GINTING,DR;Jl. Raya Pagaden - Pamanukan;-;dr. Anggraeni;81220000590;
32134064;32;Jawa Barat;13;3213;Subang;4;Dokter Praktek Mandiri;064;RADIUS AL KODRAT, DR;Balingbing, Pagaden Barat;-;-;-;
32134065;32;Jawa Barat;13;3213;Subang;4;Dokter Praktek Mandiri;065;RAHMI, DR;Sumurgintung, Pagaden Barat;-;-;-;
32134066;32;Jawa Barat;13;3213;Subang;4;Dokter Praktek Mandiri;066;ANIA, DR;Pagaden Barat;-;-;-;
32134067;32;Jawa Barat;13;3213;Subang;4;Dokter Praktek Mandiri;067;RANDI, DR;Jl,H,Ikhsan,Pamanukan, Rancasari, Kec. Pamanukan, Kabupaten Subang;-;dr. Randi;81320298736;
32134068;32;Jawa Barat;13;3213;Subang;4;Dokter Praktek Mandiri;068;IPAH SITI FAHRUNISA, DR;Jl. Raya Pantura - Patokbeusi;-;dr.Ipah;8127911311;
32134069;32;Jawa Barat;13;3213;Subang;4;Dokter Praktek Mandiri;069;LINDA SAADAH, DR;Jl. Tambak Dahan, Tambakdahan, Kec. Tambakdahan, Kab. Subang,;-;dr. Linda;82226166654;
32134070;32;Jawa Barat;13;3213;Subang;4;Dokter Praktek Mandiri;070;SURIYANTO, DR;Tambakdahan;-;-;-;
32134071;32;Jawa Barat;13;3213;Subang;4;Dokter Praktek Mandiri;071;PIPIH PERTIWI, DR;Parakan panjang No. 37 RT08/03, Bantarsari, Kec. Cijambe, Kabupaten Subang;-;-;-;
32134072;32;Jawa Barat;13;3213;Subang;4;Dokter Praktek Mandiri;072;SRI BUDIARTI, DR;Tanjungwangi;-;-;-;
32134073;32;Jawa Barat;13;3213;Subang;4;Dokter Praktek Mandiri;073;WAWAN SETIAWAN, DR;Jalan Raya, Tanjungsiang, Subang;-;dr. Wawan Setiawan;85966744112;
32134074;32;Jawa Barat;13;3213;Subang;4;Dokter Praktek Mandiri;074;ADIKA TITO DHARMADI, DR;Jl. Raya Tanjungsaing;-;-;-;
32134075;32;Jawa Barat;13;3213;Subang;4;Dokter Praktek Mandiri;075;FAIZAL AKBAR, DR;Cibereum Rt 017/Rw 07, Kec. Tanjungsiang, Kab. Subang;-;-;-;
32134076;32;Jawa Barat;13;3213;Subang;4;Dokter Praktek Mandiri;076;BAMBANG INDRA, DR;Tanjungsiang;-;-;-;
32136001;32;Jawa Barat;13;3213;Subang;6;Laboratorium;001;Labkesda Subang;Jl. D. Kartawigenda;-;;;
32136002;32;Jawa Barat;13;3213;Subang;6;Laboratorium;002;Lab. Medis Jasa Kartini;Jl. Otto Iskandardinata No.69, Karanganyar, Kec. Subang, Kabupaten Subang;;;;
32136003;32;Jawa Barat;13;3213;Subang;6;Laboratorium;003;Lab Angsana;Jl. Raya Kalijati No.KM 3, Marengmang, Kec. Kalijati, Kabupaten Subang;;;;
32136004;32;Jawa Barat;13;3213;Subang;6;Laboratorium;004;Lab. Medis Kimia Farma Subang;Jl. Otto Iskandardinata, Karanganyar, Kec. Subang, Kabupaten Subang;;;;
32136005;32;Jawa Barat;13;3213;Subang;6;Laboratorium;005;Lab Medis De Fortress;Jl. Cagak, RT.15 RW02, Kec, Kec. Jalancagak,;;;;
32136006;32;Jawa Barat;13;3213;Subang;6;Laboratorium;006;Lab Medis Setia;Jl. Ion Martasasmita No.36, Rancasari, Kec. Pamanukan, Kabupaten Subang;;;;
32136007;32;Jawa Barat;13;3213;Subang;6;Laboratorium;007;Lab.Medis Sahabat;l. Raya Cagak-Subang No.22, Tambakmekar, Kec. Jalancagak, Kabupaten Subang;;;;
