31753109;31;DKI Jakarta;75;3175;Jakarta Utara;3;Klinik;109;KLINIK PRATAMA POLRES KEPULAUAN SERIBU;Jl. Lodan Timur No.7 Dermaga Marina Ancol;021-4409465;;8,88E+15;
31753110;31;DKI Jakarta;75;3175;Jakarta Utara;3;Klinik;110;KLINIK PRATAMA POLRES METRO JAKARTA UTARA;Jl. Yos Sudarso No.1, RT.1/RW.12, Rawabadak Utara, Kec. Koja, Kota Jkt Utara;;;0821 8166 6588;
31753111;31;DKI Jakarta;75;3175;Jakarta Utara;3;Klinik;111;KLINIK PRATAMA POLRES PELABUHAN TANJUNG PRIOK;Jl. Raya Pelabuhan No.9, Kel. Tanjung Priok, Kec. Tanjung Priok;;;81315007213;
31753112;31;DKI Jakarta;75;3175;Jakarta Utara;3;Klinik;112;KLINIK PRATAMA PRODIA SUNTER GRIYA;Jl.Griya Utama Blok A No.22, Kel. Sunter Agung, Kec. Tanjung Priok;;;85215292448;
31753113;31;DKI Jakarta;75;3175;Jakarta Utara;3;Klinik;113;KLINIK PRATAMA PROVITALITAS;;;;;tidak ada dalam database program TBC Jakut
31753114;31;DKI Jakarta;75;3175;Jakarta Utara;3;Klinik;114;KLINIK PRATAMA PT ASTRA DAIHATSU MOTOR;Jl. Gaya Motor III No.5, Kel. Sungai Bambu, Kec. Tanjung Priok;;;8159132927;
31753115;31;DKI Jakarta;75;3175;Jakarta Utara;3;Klinik;115;KLINIK PRATAMA PT INDONESIA POWER PRO POMU;;;;;tidak ada dalam database program TBC Jakut
31753116;31;DKI Jakarta;75;3175;Jakarta Utara;3;Klinik;116;KLINIK PRATAMA PT. ASTRA HONDA MOTOR P1 SUNTER;;;;;tidak ada dalam database program TBC Jakut
31753117;31;DKI Jakarta;75;3175;Jakarta Utara;3;Klinik;117;KLINIK PRATAMA PT. ASTRA HONDA MOTOR P2 PEGANGSAAN;;;;;tidak ada dalam database program TBC Jakut
31753118;31;DKI Jakarta;75;3175;Jakarta Utara;3;Klinik;118;KLINIK PRATAMA PT. KOMATSU INDONESIA;Jl. Cakung Cilincing Raya No.KM. 4, RT.7/RW.2, Sukapura, Kec. Cilincing, Kota Jkt Utara, Daerah Khusus Ibukota Jakarta 14140;;;81210304386;
31753119;31;DKI Jakarta;75;3175;Jakarta Utara;3;Klinik;119;KLINIK PRATAMA PYODRA;;;;;tidak ada dalam database program TBC Jakut
31753120;31;DKI Jakarta;75;3175;Jakarta Utara;3;Klinik;120;KLINIK PRATAMA RAJAWALI;Jl. Pademangan I No. 4, RT002/RW006, Pademangan Barat, Kec. Pademangan;;;817708950;
31753121;31;DKI Jakarta;75;3175;Jakarta Utara;3;Klinik;121;KLINIK PRATAMA RUMAH ZAKAT JAKARTA UTARA;Jl. Cipeucang IV No.2A, RT.10/RW.12, Koja, Kec. Koja, Kota Jkt Utara, Daerah Khusus Ibukota Jakarta 14220;;;81905088730;
31753122;31;DKI Jakarta;75;3175;Jakarta Utara;3;Klinik;122;KLINIK PRATAMA SAHABAT;Jl. Parangtritis Raya No. 1 AH, RT004/RW002, Ancol, Kec. Pademangan;;;85695121415;
31753123;31;DKI Jakarta;75;3175;Jakarta Utara;3;Klinik;123;KLINIK PRATAMA SAMAN;Jl. Camar 11 No. 76, Gg. 4R No.9, RW.7, Semper Bar., Kec. Cilincing, Kota Jkt Utara, Daerah Khusus Ibukota Jakarta 14130;;;82192838818 (dr Deni);
31753124;31;DKI Jakarta;75;3175;Jakarta Utara;3;Klinik;124;KLINIK PRATAMA SAMARITAN;KOMPLEK RUKO PARADISE II BLOK C NO. 20-21, JL. SUNTER PERMAI RAYA;;;;
31753125;31;DKI Jakarta;75;3175;Jakarta Utara;3;Klinik;125;KLINIK PRATAMA SATHYA SAI 2;Jl. Kali Baru Timur IV No.38, RT.15/RW.3, Kali Baru, Kec. Cilincing, Kota Jkt Utara, Daerah Khusus Ibukota Jakarta 14110;;;82125752575;
31753126;31;DKI Jakarta;75;3175;Jakarta Utara;3;Klinik;126;KLINIK PRATAMA SISMA MEDIKAL SEMPER;Jalan Raya Kesemek No.3-5, RT.1/RW.13, Kel. Semper Barat, Cilincing;;;82113500321;
31753127;31;DKI Jakarta;75;3175;Jakarta Utara;3;Klinik;127;KLINIK PRATAMA SISMA MEDIKAL SUNTER;Jl. Sunter Kemayoran No.4, RT.3/RW.5, Kel. Sunter Jaya, Kec. Tanjung Priok;;;82297789330;
31753128;31;DKI Jakarta;75;3175;Jakarta Utara;3;Klinik;128;KLINIK PRATAMA SISMA MEDIKAL WARAKAS;Jl.Gembira No.18 RT.5/RW.7, Kel. Sungai Bambu, Kec. Tanjung Priok;;;81228384543;
31753129;31;DKI Jakarta;75;3175;Jakarta Utara;3;Klinik;129;KLINIK PRATAMA SUNTER;Ruko Mitra Sunter, Jl.Mitra Sunter Boulevard Blok B No.41, Sunter Jaya, Kota Jakarta Utara;;;8990909890;
31753130;31;DKI Jakarta;75;3175;Jakarta Utara;3;Klinik;130;KLINIK PRATAMA SYIFA MEDICAL CENTER;JL. LONTAR LUAR NO.7, RT.5/RW.4, TUGU UTARA, KEC. KOJA, KOTA JKT UTARA, DAERAH KHUSUS IBUKOTA JAKARTA 14260;;;83898256898;
31753131;31;DKI Jakarta;75;3175;Jakarta Utara;3;Klinik;131;KLINIK PRATAMA TPK KOJA;;;;;tidak ada dalam database program TBC Jakut
31753132;31;DKI Jakarta;75;3175;Jakarta Utara;3;Klinik;132;KLINIK PRATAMA TRITUNGGAL;Jl. Gedong Panjang No.6, RT.021/RW.007, Penjaringan, Kec. Penjaringan;;;81298843146;
31753133;31;DKI Jakarta;75;3175;Jakarta Utara;3;Klinik;133;KLINIK PRATAMA WIRA MEDIKA;;;;;tidak ada dalam database program TBC Jakut
31753134;31;DKI Jakarta;75;3175;Jakarta Utara;3;Klinik;134;KLINIK PRATAMA WIRADHARMMESTI BNN KOTA JAKARTA UTARA;Jl. Danau Agung III No.5, Kel. Sunter Agung, Kec. Tanjung Priok;;;81282134661;
31753135;31;DKI Jakarta;75;3175;Jakarta Utara;3;Klinik;135;KLINIK PRATAMA YAKRI;Jl. Prapatan Semper No.31 RT.007/13, Kel. Tugu Utara, Kec. Koja, Jakarta Utara;;;87889450841;
31753136;31;DKI Jakarta;75;3175;Jakarta Utara;3;Klinik;136;KLINIK PRATAMA YUGEN;;;;;tidak ada dalam database program TBC Jakut
31753137;31;DKI Jakarta;75;3175;Jakarta Utara;3;Klinik;137;KLINIK PRODIA SUNTER;Jl. Danau Sunter Utara Blok C2 No. 1B & 1C, RT.16/RW.11, Kel. Sunter Agung, Kec. Tanjung Priok;;;85889001004;
31753138;31;DKI Jakarta;75;3175;Jakarta Utara;3;Klinik;138;KLINIK RATA;;;;;tidak ada dalam database program TBC Jakut
31753139;31;DKI Jakarta;75;3175;Jakarta Utara;3;Klinik;139;KLINIK SANTO YOSEF;Jl. Ganggeng VI No.9, RT.11/RW.1, Kel. Sungai Bambu, Kec. Tanjung Priok;;;81284562420;
31753140;31;DKI Jakarta;75;3175;Jakarta Utara;3;Klinik;140;KLINIK SBN;;;;;tidak ada dalam database program TBC Jakut
31753141;31;DKI Jakarta;75;3175;Jakarta Utara;3;Klinik;141;KLINIK SEJAHTERA;JALAN GUSTI PERMATA 5 NO. 1A;;;81284800487;
31753142;31;DKI Jakarta;75;3175;Jakarta Utara;3;Klinik;142;KLINIK SOLA GRACIA;Jl. Alu Goro Blok A 17D No.1, RT.1/RW.18, Kel. Sunter Agung, Kec. Tanjung Priok;;;8129708891;
31753143;31;DKI Jakarta;75;3175;Jakarta Utara;3;Klinik;143;KLINIK SUASANA SEHAT;Ruko Inkopal Blok C No.39-41 Jl. Boulevard Barat Raya, Kel Kelapa Gading Barat;;;81286546611;
31753144;31;DKI Jakarta;75;3175;Jakarta Utara;3;Klinik;144;KLINIK SUNTER MEDICAL CENTRE;tidak ada dalam database program TBC Jakut;;;;
31753145;31;DKI Jakarta;75;3175;Jakarta Utara;3;Klinik;145;KLINIK UTAMA ARMEDIKA;Komp. Ruko Gading Bukit Indah, Jl. Gading Kirana I No.10, RT.18/RW.8, Klp. Gading Bar., Kec. Klp. Gading, Kota Jkt Utara, Daerah Khusus Ibukota Jakarta 14240;;;81367808160;
31753146;31;DKI Jakarta;75;3175;Jakarta Utara;3;Klinik;146;KLINIK UTAMA BEYOUTIFUL BY DR TOMPI KELAPA GADING;tidak ada dalam database program TBC Jakut;;;;
31753147;31;DKI Jakarta;75;3175;Jakarta Utara;3;Klinik;147;KLINIK UTAMA BIO MEDIKA ANGKE;tidak ada dalam database program TBC Jakut;;;;
31753148;31;DKI Jakarta;75;3175;Jakarta Utara;3;Klinik;148;KLINIK UTAMA BIO MEDIKA KELAPA GADING;tidak ada dalam database program TBC Jakut;;;;
31753149;31;DKI Jakarta;75;3175;Jakarta Utara;3;Klinik;149;KLINIK UTAMA BIO MEDIKA SUNTER;tidak ada dalam database program TBC Jakut;;;;
31753150;31;DKI Jakarta;75;3175;Jakarta Utara;3;Klinik;150;KLINIK UTAMA BIOTEST;Jl. Ruko Kensington Blok A-03, Kelapa Gading Timur, Kec. Kelapa Gading, Jakarta Utara;;mutiasng@gmail.com;81318048738;
31753151;31;DKI Jakarta;75;3175;Jakarta Utara;3;Klinik;151;KLINIK UTAMA BP3IP;Jl. Danau Sunter Utara, RT.1/RW.4, Kel. Papango, Kec. Tanjung Priok;;;;
31753152;31;DKI Jakarta;75;3175;Jakarta Utara;3;Klinik;152;KLINIK UTAMA CELL SCIENCE REJUVENATION CENTRE;tidak ada dalam database program TBC Jakut;;;;
31753153;31;DKI Jakarta;75;3175;Jakarta Utara;3;Klinik;153;KLINIK UTAMA DHARMA HUSADA;Jl. Jemb. Dua Raya No.18, RT.1/RW.3, Pejagalan, Kec. Penjaringan, Kota Jkt Utara, Daerah Khusus Ibukota Jakarta 14450;;nellafanita2326@gmail.com;81283883875;
31753154;31;DKI Jakarta;75;3175;Jakarta Utara;3;Klinik;154;KLINIK UTAMA ERKA MEDIKA;Jl. Anggrek No.23a, RT.2/RW.12, Rawabadak Utara, Kec. Koja, Kota Jkt Utara, Daerah Khusus Ibukota Jakarta 14230;;erkamedikaklinik99@gmail.com;81289826616;
31753155;31;DKI Jakarta;75;3175;Jakarta Utara;3;Klinik;155;KLINIK UTAMA FASTMED;Jl. Mangga Dua Raya, RT.011/RW.005, Ancol, Kec. Pademangan;;pandan3004@gmail.com;85775890108;
31753156;31;DKI Jakarta;75;3175;Jakarta Utara;3;Klinik;156;KLINIK UTAMA GLORI MEDIKA;Ruko Green Lake Sunter unit TB-E I, Jl. Agung Timur 1, Kel. Sunter Agung, Kec. Tanjung Priok;;;82116021707;
31753157;31;DKI Jakarta;75;3175;Jakarta Utara;3;Klinik;157;KLINIK UTAMA HILDA ALNAIRA;Jl. Mahoni No.55, RT.3/RW.15, Lagoa, Kec. Koja, Kota Jkt Utara, Daerah Khusus Ibukota Jakarta 14260;;ayups16@gmail.com;85771525326;
31753158;31;DKI Jakarta;75;3175;Jakarta Utara;3;Klinik;158;KLINIK UTAMA INDOSEHAT 2003;;;;;bingung indosehat yg mana, karena terdapat beberapa klinik
31753159;31;DKI Jakarta;75;3175;Jakarta Utara;3;Klinik;159;KLINIK UTAMA INDOSEHAT 2003 CILINCING;Komp. Ex Gaya Motor Jl.Isuzu No.29 No.004 RW.008, Semper Tim., Kec. Cilincing, Kota Jkt Utara, Daerah Khusus Ibukota Jakarta 14130;;;"85298773007 ; 085697708177 (dr. Yusra)";
31753160;31;DKI Jakarta;75;3175;Jakarta Utara;3;Klinik;160;KLINIK UTAMA JAKARTA MARINDO;Kompleks Perkantoran Yos Sudarso Megah Blok B No.1 Kav. 1, Jl. Laksamana Yos Sudarso, RT.16/RW.6, Kel. Kebon Bawang, Kec. Tanjung Priok;;;81280649998;
31753161;31;DKI Jakarta;75;3175;Jakarta Utara;3;Klinik;161;KLINIK UTAMA KELUARGA MULIA;Jl. Kramat Jaya Raya No.1, RT.9/RW.14, Lagoa, Kec. Koja, Kota Jkt Utara, Daerah Khusus Ibukota Jakarta 14270;;atikbudi11@gmail.com;81584991979;
31753162;31;DKI Jakarta;75;3175;Jakarta Utara;3;Klinik;162;KLINIK UTAMA KIRANA MEDIKA MARITIME CLINIC;Jl. Bugis No.17B, RT.7/RW.6, Kel. Kebon Bawang, Kec. Tanjung Priok;;;81343552307;nama di database jakut : Klinik Kirana Medica
31753163;31;DKI Jakarta;75;3175;Jakarta Utara;3;Klinik;163;KLINIK UTAMA LIDO;Jl. Anggrek No.37, RT.2/RW.12, Rawabadak Utara, Kec. Koja, Jkt Utara, Daerah Khusus Ibukota Jakarta 14230;;;8179801727;
31753164;31;DKI Jakarta;75;3175;Jakarta Utara;3;Klinik;164;KLINIK UTAMA MEDIKA MUARA KARANG;Jl. Muara Karang Blok R4 Timur No. 2-4, RT009/ RW003, Pluit, Kec. Penjaringan;;sitimariyyati8@gmail.com;82112716628;
31753165;31;DKI Jakarta;75;3175;Jakarta Utara;3;Klinik;165;KLINIK UTAMA NATHANIA;;;;;tidak ada dalam database program TBC Jakut
31753166;31;DKI Jakarta;75;3175;Jakarta Utara;3;Klinik;166;KLINIK UTAMA NMW;;;;;tidak ada dalam database program TBC Jakut
31753167;31;DKI Jakarta;75;3175;Jakarta Utara;3;Klinik;167;KLINIK UTAMA NON RAWAT INAP DR. IRAWAN WAHYUDI,SP.BP-RE;;;;;tidak ada dalam database program TBC Jakut
31753168;31;DKI Jakarta;75;3175;Jakarta Utara;3;Klinik;168;KLINIK UTAMA PERMATA INDAH MEDICAL CENTER;Kompleks Perumahan Taman Permata Indah 2 Blok E NO. 8, RT.012/RW.014, Pejagalan, Kec. Penjaringan;;;82112713378;
31753169;31;DKI Jakarta;75;3175;Jakarta Utara;3;Klinik;169;KLINIK UTAMA PRODIA;;;;;bingung prodia yg mana, karena terdapat beberapa klinik prodia
31753170;31;DKI Jakarta;75;3175;Jakarta Utara;3;Klinik;170;KLINIK UTAMA PRODIA KELAPA GADING;Jl. Boulevard Raya Jl. Raya Klp. Gading, Permai No.15, RT.1/RW.2, Klp. Gading Tim., Kec. Klp Gading, Jkt Utara, Daerah Khusus Ibukota Jakarta;;;;
31753171;31;DKI Jakarta;75;3175;Jakarta Utara;3;Klinik;171;KLINIK UTAMA PRODIA PANTAI INDAH KAPUK;Rukan Goldcoast No.B2-B3 Pantai Indah Kapuk;;;;
31753172;31;DKI Jakarta;75;3175;Jakarta Utara;3;Klinik;172;KLINIK UTAMA PURI MEDIKA MEDICAL CHECK UP;;;;;tidak ada dalam database program TBC Jakut
31753173;31;DKI Jakarta;75;3175;Jakarta Utara;3;Klinik;173;KLINIK UTAMA QUEEN;;;;;tidak ada dalam database program TBC Jakut
31753174;31;DKI Jakarta;75;3175;Jakarta Utara;3;Klinik;174;KLINIK UTAMA SIRRATAMA;;;;;tidak ada dalam database program TBC Jakut
31753175;31;DKI Jakarta;75;3175;Jakarta Utara;3;Klinik;175;KLINIK UTAMA STIP;Jl. Marunda Makmur, RT.1/RW.1, Marunda, Kec. Cilincing, Kota Jkt Utara, Daerah Khusus Ibukota Jakarta 14150;;memyselfririanita.dr@gmail.com;81291428507;
31753176;31;DKI Jakarta;75;3175;Jakarta Utara;3;Klinik;176;KLINIK UTAMA THE INDRA;;;;;tidak ada dalam database program TBC Jakut
31753177;31;DKI Jakarta;75;3175;Jakarta Utara;3;Klinik;177;KLINIK UTAMA VANERA;;;;;tidak ada dalam database program TBC Jakut
31753178;31;DKI Jakarta;75;3175;Jakarta Utara;3;Klinik;178;KLINIK WAHANA SEJAHTERA;Jl. Rusa Lestari No.9, RW.9, Sukapura, Kec. Cilincing, Kota Jkt Utara, Daerah Khusus Ibukota Jakarta 14140;;edria_riskiultra@gmail.com;818583600;
31753179;31;DKI Jakarta;75;3175;Jakarta Utara;3;Klinik;179;KLINIK WAHANA SEJAHTERA 2;Jl. Kebon Bawang VI No.57, RT.12/RW.6, Kel. Kebon Bawang, Kec. Tanjung Priok;;;85695871185;
31753180;31;DKI Jakarta;75;3175;Jakarta Utara;3;Klinik;180;LIGHTHOUSE;;;;;tidak ada dalam database program TBC Jakut
31753181;31;DKI Jakarta;75;3175;Jakarta Utara;3;Klinik;181;LOTUS CLINIC;;;;;tidak ada dalam database program TBC Jakut
31753182;31;DKI Jakarta;75;3175;Jakarta Utara;3;Klinik;182;MEDIGREEN;;;;;tidak ada dalam database program TBC Jakut
31753183;31;DKI Jakarta;75;3175;Jakarta Utara;3;Klinik;183;MEDIGREEN MUARA KARANG;;;;;tidak ada dalam database program TBC Jakut
31753184;31;DKI Jakarta;75;3175;Jakarta Utara;3;Klinik;184;MIMI HEALTH CARE;;;;;tidak ada dalam database program TBC Jakut
31753185;31;DKI Jakarta;75;3175;Jakarta Utara;3;Klinik;185;MINT;;;;;tidak ada dalam database program TBC Jakut
31753186;31;DKI Jakarta;75;3175;Jakarta Utara;3;Klinik;186;MIRACLE BOGASARI;Jl. Raya Cilincing No.1, RW.11, Kali Baru, Kec. Cilincing, Kota Jkt Utara, Daerah Khusus Ibukota Jakarta 14110;;miracle@gmail.com;85959810405;
31753187;31;DKI Jakarta;75;3175;Jakarta Utara;3;Klinik;187;MITRASANA BOULEVARD TIMUR;Ruko Boulevard Timur Blok NC1 No. 42-43, RT.1, RW.12, Pegangsaan Dua, Kec. Klp. Gading, Kota Jkt Utara, Daerah Khusus Ibukota Jakarta 14250;;rafangelia@gmail.com;81388648379;
31753188;31;DKI Jakarta;75;3175;Jakarta Utara;3;Klinik;188;NEWMED CLINIC;;;;;tidak ada dalam database program TBC Jakut
31753189;31;DKI Jakarta;75;3175;Jakarta Utara;3;Klinik;189;NEXUS MEDICA;Jl. Boulevard Bar. Raya Kompleks Plaza No.60, RT.2/RW.9, Klp. Gading Bar., Kec. Klp. Gading, Kota Jkt Utara, Daerah Khusus Ibukota Jakarta 14240;;ervina.kim@gmail.com;87880887070;
31753190;31;DKI Jakarta;75;3175;Jakarta Utara;3;Klinik;190;NK HEALTH;Blok LC 7 No, Jl. Boulevard Bar. Raya No.42, RT.13/RW.7, Klp. Gading Bar., Kec. Klp. Gading, Kota Jkt Utara, Daerah Khusus Ibukota Jakarta 14240;;drrizki30@gmail.com;81226015342;
31753191;31;DKI Jakarta;75;3175;Jakarta Utara;3;Klinik;191;NT CLINIC;Boulevard Kelapa Gading Blok LB3 No 16-17, RT.12/RW.18, Klp. Gading Tim., Jakarta, Kota Jkt Utara, Daerah Khusus Ibukota Jakarta 14240;;kardina.dina51@gmail.com;85340952215;
31753192;31;DKI Jakarta;75;3175;Jakarta Utara;3;Klinik;192;OMEDICA;;;;;tidak ada dalam database program TBC Jakut
31753193;31;DKI Jakarta;75;3175;Jakarta Utara;3;Klinik;193;POLIKLINIK KESEHATAN 00.09.02/JU;Jl. Lagoa Kanal No.1A, RT.3/RW.2, Kel. Kebon Bawang, Kec. Tanjung Priok;;;;
31753194;31;DKI Jakarta;75;3175;Jakarta Utara;3;Klinik;194;POLIKLINIK POL AIR JAKARTA UTARA;;;;;di database ada : DIT POL AIR BAHARKAM POLRI dan Pusdik Pol Air Jakut
31753195;31;DKI Jakarta;75;3175;Jakarta Utara;3;Klinik;195;PRATAMA DANIA;Jl. Rorotan I No.4, RT.4/RW.10, Rorotan, Kec. Cilincing, Kota Jkt Utara, Daerah Khusus Ibukota Jakarta 13910;;;81281914664;
31753196;31;DKI Jakarta;75;3175;Jakarta Utara;3;Klinik;196;PRODIA HEALTH CARE;;;;;ada beberapa klinik prodia
31753197;31;DKI Jakarta;75;3175;Jakarta Utara;3;Klinik;197;PURE LASER CLINIC MALL KELAPA GADING;;;;;tidak ada dalam database program TBC Jakut
31753198;31;DKI Jakarta;75;3175;Jakarta Utara;3;Klinik;198;RE MD KLINIK;;;;;tidak ada dalam database program TBC Jakut
31753199;31;DKI Jakarta;75;3175;Jakarta Utara;3;Klinik;199;ROYALE REJUVIA;;;;;tidak ada dalam database program TBC Jakut
31753200;31;DKI Jakarta;75;3175;Jakarta Utara;3;Klinik;200;SATPELKES DINAS PPKUKM;Jl. Perintis Kemerdekaan BGR 1 No.3, RW.5, Klp. Gading Bar., Kec. Klp. Gading, Jakarta Utara;;;;
31753201;31;DKI Jakarta;75;3175;Jakarta Utara;3;Klinik;201;SATPELKES WALIKOTA JAKARTA UTARA;Jl. Yos Sudarso No.27 - 29, RT.19/RW.5, Kb. Bawang, Kec. Tj. Priok, Kota Jkt Utara;;;;
31753202;31;DKI Jakarta;75;3175;Jakarta Utara;3;Klinik;202;SEMPER MEDICAL CENTRE;;;;;tidak ada dalam database program TBC Jakut
31753203;31;DKI Jakarta;75;3175;Jakarta Utara;3;Klinik;203;SILOAM CLINIC SUNTER;Jl. Danau Sunter Utara Blok R Kav. No.65, RT.1/RW.19, Kel. Sunter Agung, Kec. Tanjung Priok;;;;
31753204;31;DKI Jakarta;75;3175;Jakarta Utara;3;Klinik;204;STEFANY;Jln. Gedong Panjang No. 68A Rt21/RW 7, Penjaringan;;catherine1905@yahoo.co.id;817876860;
31753205;31;DKI Jakarta;75;3175;Jakarta Utara;3;Klinik;205;SUDARMO;Jalan Mahoni No 63 Tanjung Priuk, RT.6/RW.15, Lagoa, Kec. Koja, Jakarta, Daerah Khusus Ibukota Jakarta 14270;;drdeddysetiawan@gmail.com;81289311972;
31753206;31;DKI Jakarta;75;3175;Jakarta Utara;3;Klinik;206;SWEET TREATS;;;;;tidak ada dalam database program TBC Jakut
31753207;31;DKI Jakarta;75;3175;Jakarta Utara;3;Klinik;207;VAXCORP INDONESIA;;;;;tidak ada dalam database program TBC Jakut
31753208;31;DKI Jakarta;75;3175;Jakarta Utara;3;Klinik;208;VIDYA MEDIKA;Jl. Tenggiri No.7C, RT.6/RW.1, Kel. Tanjung Priok, Kec. Tanjung Priok;;;;
31753209;31;DKI Jakarta;75;3175;Jakarta Utara;3;Klinik;209;WIJAYA MEDIKA;Jl. Tenggiri No.7C, RT.6/RW.1, Kel. Tanjung Priok, Kec. Tanjung Priok;;;;
31754001;31;DKI Jakarta;75;3175;Jakarta Utara;4;Dokter Praktek Mandiri;001;DR CARLA CRISIVIN MAGDALENA;Jl. Kebon Bawang VI No.28, RT.6/RW.6 Apotik Kebon Bawang, Kel. Kebon Bawang, Kec. Tanjung Priok;;;89629655591;
31754002;31;DKI Jakarta;75;3175;Jakarta Utara;4;Dokter Praktek Mandiri;002;DR. CHAND DHIRAJ NAGPAL - PRAKTEK DOKTER UMUM;Jl. Griya Mulia Blok D No.1, Kel. Sunter Agung, Kec. Tanjung Priok;;;85692088884;
31754003;31;DKI Jakarta;75;3175;Jakarta Utara;4;Dokter Praktek Mandiri;003;DR. THONG MAJAMSARI;Jl. Muara Karang Blok 0.8.T No. 55, RT.005/ RW. 014, Kel. Pluit;;;81808888815;
31754004;31;DKI Jakarta;75;3175;Jakarta Utara;4;Dokter Praktek Mandiri;004;DR.ALOYSIA ERNIAWATY;Jl. Walet Indah I Blok N1 No. 15, RT.012/ RW.006;;;6,28E+17;
31754005;31;DKI Jakarta;75;3175;Jakarta Utara;4;Dokter Praktek Mandiri;005;PRAKTEK DOKTER MUTHOHARRAH;Jl. Tipar cakung gg. Sma 83 no 110, RT.4/RW.4, Sukapura, Kec. Cilincing, Kota Jkt Utara, Daerah Khusus Ibukota Jakarta 14140;;dokterimut@gmail.com;85215773583;
31754006;31;DKI Jakarta;75;3175;Jakarta Utara;4;Dokter Praktek Mandiri;006;PRAKTEK DR. SURIANTY;JL. BUDI MULIA NO. 14 RT. 013 RW. 007;;;81807825887;
31754007;31;DKI Jakarta;75;3175;Jakarta Utara;4;Dokter Praktek Mandiri;007;PRAKTEK MANDI DR. MEGAWATI WIJAYA, M.M.;;;;;tidak ada dalam database program TBC Jakut
31754008;31;DKI Jakarta;75;3175;Jakarta Utara;4;Dokter Praktek Mandiri;008;PRAKTEK MANDIRI DOKTER AGENG;;;;;tidak ada dalam database program TBC Jakut
31754009;31;DKI Jakarta;75;3175;Jakarta Utara;4;Dokter Praktek Mandiri;009;PRAKTEK MANDIRI DOKTER BIANAWATI WIJAYA;Jl. Jembatan Dua Sinar Budi Rt. 003 Rw. 004;;billan7577@gmail.com;81385268597;
31754010;31;DKI Jakarta;75;3175;Jakarta Utara;4;Dokter Praktek Mandiri;010;PRAKTEK MANDIRI DOKTER WITARUN;;;;;tidak ada dalam database program TBC Jakut
31754011;31;DKI Jakarta;75;3175;Jakarta Utara;4;Dokter Praktek Mandiri;011;PRAKTEK MANDIRI DR MEI INDERAWATI;Jl. Warakas I No.86-88, RT.12/RW.3 (Klinik Velda), Kel. Warakas, Kec. Tanjung Priok;;;8192616435;
31754012;31;DKI Jakarta;75;3175;Jakarta Utara;4;Dokter Praktek Mandiri;012;PRAKTEK MANDIRI DR SENTOSA;"JL TELUK GONG RAYA 328-C, RT/RW; 08/08, Pejagalan, Kec. Penjaringan";;dr_sentosa@ymail.com;8161821986;
31754013;31;DKI Jakarta;75;3175;Jakarta Utara;4;Dokter Praktek Mandiri;013;PRAKTEK MANDIRI DR SINTHA;Teluk Gong Jl. C No. 195 A, Kel. Pejagalan;;;85880575970;
31754014;31;DKI Jakarta;75;3175;Jakarta Utara;4;Dokter Praktek Mandiri;014;PRAKTEK MANDIRI DR SURYADI;Jl. Gusti Permata No.19-20, RT.11/RW.14/ Jl. Tanah Pasir;;;85880575970;di database adanya: dr. Suryadi Darmawi Tan
31754015;31;DKI Jakarta;75;3175;Jakarta Utara;4;Dokter Praktek Mandiri;015;PRAKTEK MANDIRI DR. LUCY INDRAWATI;Jl. Kelapa Cengkir Raya Blok WF 2/2 Rt. 06 Rw. 015 Kelapa Gading Timur Kecamatan Kelapa Gading;;lucykosa@yahoo.com;8161852307;
31754016;31;DKI Jakarta;75;3175;Jakarta Utara;4;Dokter Praktek Mandiri;016;PRAKTEK MANDIRI DR.BEITY NUR ALIMAH;Apartemen Gading Nias Residence Tower Alamanda C1,12 Kelurahan Pegangsaan Dua Kecamatan Kelapa Gading;;beitysuhartoyo.bna@gmail.com;;
31754017;31;DKI Jakarta;75;3175;Jakarta Utara;4;Dokter Praktek Mandiri;017;PRAKTIK DOKTER LIE LIDIA;Jl. Sunter Kemayoran No.8 RT.10/RW.2, Kel. Sunter Jaya, Kec. Tanjung Priok;;;87882467099;
31754018;31;DKI Jakarta;75;3175;Jakarta Utara;4;Dokter Praktek Mandiri;018;PRAKTIK MANDIRI DOKTER ADNAN SETIAWAN GUNAWAN;Apotek Bina Medika, Komplek Ruko Remaco, Jl. Tanah Pasir No.1, RT.010/ RW.007;;greg.adnan@yahoo.com;85880412345;
31754019;31;DKI Jakarta;75;3175;Jakarta Utara;4;Dokter Praktek Mandiri;019;PRAKTIK MANDIRI DOKTER DR ANDREAS SANUSI KURNIAWAN;Jl. Waspada Raya No. 24, RT011/ RW015, Pademangan Barat, Kec. Pademangan;;andreassanusikurniawan@yahoo.com;8129965032;
31754020;31;DKI Jakarta;75;3175;Jakarta Utara;4;Dokter Praktek Mandiri;020;PRAKTIK MANDIRI DOKTER DR RUDY WENARTA;;;;;tidak ada dalam database program TBC Jakut
31754021;31;DKI Jakarta;75;3175;Jakarta Utara;4;Dokter Praktek Mandiri;021;PRAKTIK MANDIRI DOKTER DR. PUTU SENNY RATNA TIRTA;Jl. Camar Permai 5 no 2 RT 03 RW 06, Kapuk Muara, Kec. Penjaringan;;putusenny@gmail.com;81380593031;
31754022;31;DKI Jakarta;75;3175;Jakarta Utara;4;Dokter Praktek Mandiri;022;PRAKTIK MANDIRI DOKTER DR. SUDIGDO;;;;;tidak ada dalam database program TBC Jakut
31754023;31;DKI Jakarta;75;3175;Jakarta Utara;4;Dokter Praktek Mandiri;023;PRAKTIK MANDIRI DOKTER FEINY GUNAWAN HARLAN;;;;;tidak ada dalam database program TBC Jakut
31754024;31;DKI Jakarta;75;3175;Jakarta Utara;4;Dokter Praktek Mandiri;024;PRAKTIK MANDIRI DOKTER GALUH INDAH SARI;;;;;tidak ada dalam database program TBC Jakut
31754025;31;DKI Jakarta;75;3175;Jakarta Utara;4;Dokter Praktek Mandiri;025;PRAKTIK MANDIRI DOKTER GRANT;Jl. Sunter Bentengan Raya No.14, RT.11/RW.5, Kel. Sunter Jaya, Kec. Tanjung Priok;;;87881556075;di database jakut adanya : dr. Lie Grant
31754026;31;DKI Jakarta;75;3175;Jakarta Utara;4;Dokter Praktek Mandiri;026;PRAKTIK MANDIRI DOKTER LUSIANA MULYANTI;Griya Residence, Jl. Beringin IV Blok A2 No.29, Gading, RT.12/RW.5, Sukapura, Cilincing, Jakarta Utara, Jakarta 14140;;luthuna_00@yahoo.com;85888881396;
31754027;31;DKI Jakarta;75;3175;Jakarta Utara;4;Dokter Praktek Mandiri;027;PRAKTIK MANDIRI DOKTER MERY LINDAWATI;;;;;tidak ada dalam database program TBC Jakut
31754028;31;DKI Jakarta;75;3175;Jakarta Utara;4;Dokter Praktek Mandiri;028;PRAKTIK MANDIRI DOKTER THOMAS AQUINO DA GOMEZ;;;;;tidak ada dalam database program TBC Jakut
31754029;31;DKI Jakarta;75;3175;Jakarta Utara;4;Dokter Praktek Mandiri;029;PRAKTIK MANDIRI DOKTER TUMEWU, PATRICK LEONARDO STEPHANUS;Jl. Lindung No.48, RT.1/RW.12, Pejagalan, Kec. Penjaringan;;patricktumewu94@gmail.com;82299038339;
31754030;31;DKI Jakarta;75;3175;Jakarta Utara;4;Dokter Praktek Mandiri;030;PRAKTIK MANDIRI DOKTER UMUM TANIA SALENDRA;Jl. Pantai Indah Selatan I Blok DA Kav, No.8;;;817709889;
31754031;31;DKI Jakarta;75;3175;Jakarta Utara;4;Dokter Praktek Mandiri;031;PRAKTIK MANDIRI DOKTER WILLY SUMARTO;Jl. Cempaka No.33 RT.6/RW.3, Kel. Sunter Agung, Kec. Tanjung Priok;;;87873377889;
31754032;31;DKI Jakarta;75;3175;Jakarta Utara;4;Dokter Praktek Mandiri;032;PRAKTIK MANDIRI DOKTER YEYEN OKTARI;;;;;tidak ada dalam database program TBC Jakut
31754033;31;DKI Jakarta;75;3175;Jakarta Utara;4;Dokter Praktek Mandiri;033;PRAKTIK MANDIRI DR CARLA NIO SHEN LING;Jl. Janur Indah IX No.12, RT.10/RW.12, Klp. Gading Bar., Kec. Klp. Gading;;;;
31754034;31;DKI Jakarta;75;3175;Jakarta Utara;4;Dokter Praktek Mandiri;034;PRAKTIK MANDIRI DR YONATHAN HERU SUHALIM;Jalan Boulevard Raya PA 19 No 10, RT.3/RW.14, Pegangsaan Dua, Jakarta, Kota Jkt Utara, Daerah Khusus Ibukota Jakarta 14250;;yonathanheru1987@gmail.com;81297036858;
31754035;31;DKI Jakarta;75;3175;Jakarta Utara;4;Dokter Praktek Mandiri;035;PRAKTIK MANDIRI DR. ASTRID TANUMIHARDJA;JL. Kelapa Nias VII RT 007/17 Pegangsaan Dua, Kelapa Gading, Jakarta 14240;;twidytarcisia@gmail.com;81585991188;
31754036;31;DKI Jakarta;75;3175;Jakarta Utara;4;Dokter Praktek Mandiri;036;PRAKTIK MANDIRI DR. LAURENCIA ARDI;;;;;tidak beroperasi, dokter sedang lanjut studi
31754037;31;DKI Jakarta;75;3175;Jakarta Utara;4;Dokter Praktek Mandiri;037;PRAKTIK MANDIRI DR. SAMUEL LIONARDI;;;;;tidak beroperasi, dokter sedang lanjut studi
31754038;31;DKI Jakarta;75;3175;Jakarta Utara;4;Dokter Praktek Mandiri;038;PRAKTIK MANDIRI DR. SUSYLIA MIHARDJA;;;;;tidak ada dalam database program TBC Jakut
31754039;31;DKI Jakarta;75;3175;Jakarta Utara;4;Dokter Praktek Mandiri;039;PRAKTIK MANDIRI DR.CARLA LEVARA;;;;;tidak ada dalam database program TBC Jakut
31754040;31;DKI Jakarta;75;3175;Jakarta Utara;4;Dokter Praktek Mandiri;040;PRAKTIK MANDIRI DR.ELIAS SETIAWAN;Jl. Gading Elok Utara II Blok FE 1/9, Klp Gading Timur, Kec. Kelapa Gading;;elias_setiawan@yahoo.com;8129480952;
31754041;31;DKI Jakarta;75;3175;Jakarta Utara;4;Dokter Praktek Mandiri;041;PRAKTIK MANDIRI DR.HARIYANTO;Jl. Kalibaru Barat IV No.4, RT.5/RW.7, Kali Baru, Kec. Cilincing, Kota Jkt Utara, Daerah Khusus Ibukota Jakarta 14110;;dr.hariyanto78@gmail.com;8568937329;
31754042;31;DKI Jakarta;75;3175;Jakarta Utara;4;Dokter Praktek Mandiri;042;PRAKTIK MANDIRI DR.TUTI ONA,MARS.;Jl. Swasembada Barat XIV No.48 RT.7/RW.14, Kel. Kebon Bawang, Kec. Tanjung Priok;;;81239612240;
32011001;32;Jawa Barat;01;3201;Bogor;1;Rumah Sakit;001;RS Eka Hospital;Perum Kota Wisata Kav. V2, Desa Nagrak, Kec. Gunung Putri Kab. Bogor, Prov. Jawa Barat;(021) 50855555;Marni;85245199750;
32011002;32;Jawa Barat;01;3201;Bogor;1;Rumah Sakit;002;RS EMC Sentul;Jl. MH. Thamrin No.Kav. 57, Sentul City, Citaringgul, Babakan Madang, Kab. Bogor, Prov. Jawa Barat;;Anita;85692397534;
